"pages","year","title","booktitle","author","citation_key","volume","number","journal"
"18--26","2022","Towards Process-Oriented IIoT Security Management: Perspectives and Challenges","Enterprise, Business-Process and Information Systems Modeling","Schönig, Stefan and Hornsteiner, Markus and Stoiber, Christoph","Schnig2022","450","",""
"230--244","2021","A Cyber Security Digital Twin for Critical Infrastructure Protection: The Intelligent Transport System Use Case","The Practice of Enterprise Modeling","Sellitto, Giovanni Paolo and Masi, Massimiliano and Pavleska, Tanja and Aranha, Helder","Sellitto2021","432","",""
"187--201","2023","Taxonomy-Based Risk Analysis with a Digital Twin","Statistical Modelling and Risk Analysis","Sellitto, Giovanni Paolo and Pavleska, Tanja and Masi, Massimiliano and Aranha, Helder","Sellitto2023","430","",""
"995--999","2023","A cyber-physical digital twin approach to replicating realistic multi-stage cyberattacks on smart grids","27th International Conference on Electricity Distribution (CIRED 2023)","Sen, Ö. and Bleser, N. and Henze, M. and Ulbig, A.","Sen2023","2023","",""
"100383","2022","Digital Twins: State of the art theory and practice, challenges, and open research questions","","Sharma, Angira and Kosasih, Edward and Zhang, Jie and Brintrup, Alexandra and Calinescu, Anisoara","Sharma2022ab","30","","Journal of Industrial Information Integration"
"338--350","2021","Secure sharing of big digital twin data for smart manufacturing based on blockchain","","Shen, Weidong and Hu, Tianliang and Zhang, Chengrui and Ma, Songhua","Shen2021a","61","","Journal of manufacturing systems"
"46–55","2022","Study Cybersecurity of Cyber Physical System in the Virtual Environment: A Survey and New Direction","Australasian Computer Science Week 2022","Shi, Lei and Krishnan, Shanti and Wen, Sheng","Shi2022","","",""
"","2019","Introduction to mago3D, an Open Source Based Digital Twin Platform","","Shin, S","Shin2019","","","Introduction to mago3D, an Open Source Based Digital Twin Platform"
"1--6","2021","Real-Time Digital Twin of Residential Energy Storage System for Cyber-Security Study","2021 IEEE 2nd International Conference on Smart Technologies for Power, Energy and Control (STPEC)","Shitole, Amardeep B. and Kandasamy, Nandha Kumar and Liew, Lin Shen and Sim, Lewin and Bui, Anh Khoa","Shitole2021","","",""
"71--87","2022","Experimental Testbeds and Design of Experiments","Cyber-Security Threats and Response Models in Nuclear Power Plants","Smidts, Carol and Ray, Indrajit and Zhu, Quanyan and Vaddi, Pavan Kumar and Zhao, Yunfei and Huang, Linan and Diao, Xiaoxu and Talukdar, Rakibul and Pietrykowski, Michael C.","Smidts2022","","",""
"145--156","2022","Towards Semantic Modeling and Simulation of Cybersecurity on the Internet of Underwater Things","Artificial Intelligence Applications and Innovations","Stavrinos, Stavros and Kotis, Konstantinos and Kalloniatis, Christos","Stavrinos2022","646","",""
"","2022","Security Attacks and Solutions for Digital Twins","","Suhail, Sabah and Zeadally, Sherali and Jurdak, Raja and Hussain, Rasheed and Matulevicius, Raimundas and Svetinovic, Davor","Suhail2022a","abs/2202.12501","","CoRR"
"103699","2022","Towards situational aware cyber-physical systems: A security-enhancing use case of blockchain-based digital twins","","Suhail, Sabah and Malik, Saif Ur Rehman and Jurdak, Raja and Hussain, Rasheed and Matulevičius, Raimundas and Svetinovic, Davor","Suhail2022ab","141","","Computers in Industry"
"606--610","2021","Research on Security Management and Control of Power Grid Digital Twin Based on Edge Computing","2021 2nd International Seminar on Artificial Intelligence, Networking and Information Technology (AINIT)","Sun, Yue and Xu, Xiaotian and Qiang, Ren and Yuan, Qinglin","Sun2021abcd","","",""
"16--22","2022","An Introduction to Digital Twin Standards","","Sun, Wen and Ma, Wenqiang and Zhou, Yu and Zhang, Yan","Sun2022","26","3","GetMobile: Mobile Comp. and Comm."
"1212--1223","2021","Cyber–Physical Production Systems for Data-Driven, Decentralized, and Secure Manufacturing—A Perspective","","Suvarna, Manu and Yap, Ken Shaun and Yang, Wentao and Li, Jun and Ng, Yen Ting and Wang, Xiaonan","Suvarna2021","7","9","Engineering"
"99--112","2022","Integrated Digital Twins and Blockchain Framework for Privacy and Security of Applications","Digital Twins for Digital Transformation: Innovation in Industry","Torky, Mohamed and Darwish, Ashraf and Hassanien, Aboul Ella","Torky2022","423","",""
"113524","2021","Digital Twin: Generalization, characterization and implementation","European Conference on Information Systems","VanDerHorn, Eric and Mahadevan, Sankaran","Vanderhorn2021","145","",""
"","2022","Security in IoT-enabled smart agriculture: architecture, security solutions and challenges","","Vangala, Anusha and Das, Ashok Kumar and Chamola, Vinay and Korotaev, Valery and Rodrigues, Joel J. P. C.","Vangala2022","","","Cluster Computing"
"250--260","2022","Digital Twins in Asset Management: Potential Application Use Cases in Rail and Road Infrastructures","15th WCEAM Proceedings","Vieira, João and Clara, João and Patrício, Hugo and Almeida, Nuno and Martins, João Poças","Vieira2022","","",""
"","2022","Closing the Implementation Gap of Digital Twins","","Wache, Hendrik and Hübner, Jan Eric and Hönigsberg, Sarah and Dinter, Barbara","Wache2022","","",""
"579--583","2022","DTCPN: A Digital Twin Cyber Platform Based on NFV","2022 IEEE 23rd International Symposium on a World of Wireless, Mobile and Multimedia Networks (WoWMoM)","Wang, Xiulei and Gao, Yan and Deng, Li and Chen, Ming","Wang2022abcdefgh","","",""
"905--921","2022","Real-Time Analysis of Multiple Root Causes for Anomalies Assisted by Digital Twin in NFV Environment","","Wang, Weili and Tang, Lun and Wang, Chenmeng and Chen, Qianbin","Wang2022abcdefghijkl","19","2","IEEE Transactions on Network and Service Management"
"","2021","A Data Processing Pipeline For Cyber-Physical Risk Assessments Of Municipal Supply Chains","2021 Winter Simulation Conference (WSC)","Weaver, Gabriel A.","Weaver2021","","",""
"1--2","2018","Introduction to the special issue on smart manufacturing","","Wu, Dazhong and Weiss, Brian A. and Kurfess, Thomas and Wang, Lihui and Davis, Jim","Wu2018","48","","Journal of Manufacturing Systems"
"1--17","2022","CommandFence: A Novel Digital-Twin-Based Preventive Framework for Securing Smart Home Systems","","Xiao, Yinhao and Jia, Yizhen and Hu, Qin and Cheng, Xiuzhen and Gong, Bei and Yu, Jiguo","Xiao2022","","","IEEE Transactions on Dependable and Secure Computing"
"1145--1158","2021","Application and research on digital twin in electronic cam servo motion control system","","Xu, Jiangtao and Guo, Tongjun","Xu2021a","112","3-4","The International Journal of Advanced Manufacturing Technology"
"","2022","A Digital Twin Framework for Cyber Security in Cyber-Physical Systems","","Zhao, Tianyu and Foo, Ernest and Tian, Hui","Zhao2022b","abs/2204.13859","","CoRR"
"1--11","2022","Digital Twin based Cyber Range for Industrial Internet of Things","","Zhou, Haifeng and Li, Mohan and Sun, Yanbin and Tian, Zhihong and Yun, Lei","Zhou2022abcde","","","IEEE Consumer Electronics Magazine"
"1--9","2022","Secure Digital Twin Migration in Edge-based Autonomous Driving System","","Zhou, Yi and Bashir, Ali Kashif and Wu, Jun and Al-Otaibi, Yasser D. and Lin, Xi and Xu, Hansong","Zhou2022abcdef","","","IEEE Consumer Electronics Magazine"
