citation_key,relevance,main_contribution,DT_definition,DT_advantages,application_domain,application_scenario,DT_location,relevant_asset,data_type,communication_type,integration_level,used_protocols,used_tools,operation_mode,DT_generator,framework,challenges
Choi2020,MEDIUM,"In this paper, we introduce a vendor-agnostic analytics framework which allows security researchers to analyse attacks againstICS systems, even if the researchers have zero control automation domain knowledge or are faced with a myriad of heterogenous ICS systems.",N/A,digital twin’ systems mimicking real-world scenarios.,Smart Manufacturing,"security testing, securit evaluation",N/A,ICS ,"The test digital twin system comprises of an HMI, two PLCs, two network switches, and a firewall – representativecomponents in most ICS scenarios.",DIGITAL_EXPERT,digital shadow,N/A,"InTouch software from Schneider Electric, CompactLogix 5370-L3, Schneider Electric Modicon M580, pfSense, ettercap, wireshark, kdiff3, Kali Linux",Simulation,N/A,N/A,"For future work, we will continue to conduct further researchon the countermeasures proposed earlier in this paper.Based on the data produced by our framework, future researchon preventative measures would be feasible and aligns wellto the ultimate goal of our framework. As an extension ofour approach, we will conduct further experiments of ourframework on an ICS with a fake PLC or add meaninglessdata fields to experiment control data integrity and resiliency."
Chukkapalli2021,MEDIUM,"Therefore in this paper, we present a smart fisheries ecosystemwhere the architecture describes various interactions that happenbetween internet connected devices. We develop a smart fisheriesontology based on the architecture and implement Attribute BasedAccess Control System (ABAC) where access to resources of smartfisheries is granted by evaluating the requests",The virtual replicas of the physical sensors deployed in the farm are represented as digital twins,"They monitor the data generated from the physical sensors and notify the fish farm owners about a breakdown of a machinery in advance to reduce downtime by training machine learning models. Digital twins canalso be utilized for maintaining the data security and privacy whichis an added advantage. For example, unauthorized transmissionof data can be avoided with the help of digital twin whenevera temporary worker tries to access previous data of the sensorspresent in the fish farm.",Smart Fishing,access control,cloud,Fish Farm,sensors present in the fishfarm via Internet.,DIGITAL_PHYSICAL,digital shadow,N/A,N/A,Replication ,N/A,YES,N/A
Cioara2021,MEDIUM,"In this paper, we will provide an overview of the DTs application domains in the smart grid while analyzing existing the state-of-the-art literature. We have focused on the following application domains: energy asset modeling, fault and security diagnosis, operational optimization, and business models.",N/A,"By twining data with accurate DT models of energy assets, valuable insights or information can be extracted and integrated within many smart grids’ applications like operation maintenance, energy prediction, security and protection, errors detection, etc.",Smart Grid,"security analysis, security testing, failure prediction, detect vulnerabilities, mitigation possibilites, threat analysis",N/A,Smart Grid with GER,Model of the whole Grid,DIGITAL_PHYSICAL,digital twin,N/A,N/A,"data-driven analytics,  simulations, what-if analyses","The first step is the creation of the DT model based on the actual measurements done on the energy assets. The energy asset model is constructed by using physics or engineering models, statistics, etc. Augmented reality models can be used for improving the human understanding of the energy assets' operational states",YES,N/A
Cioroaica2019,LOW,"In this paper, we introduce a method and a test platformthat support virtual evaluation of decisions at runtime, therebysupporting trust building within SES. The key idea behind theplatform is that it employs and evaluates Digital Twins, whichare executable models of system components, to learn aboutcomponent behavior in observed situations",The notion of a Digital Twin has bee nintroduced by NASA as a realistic digital representation of a flying object used in lab testing activities Since then the notion of Digital Twin has also been adopted in the emerging Industry 40 for representing the status of production devices an dto enable forecast of change impacts,afe real-time evaluation during the runtime of smartagents.,Smart Ecosystem,"detection of simulated environments, identification of malicious agents",N/A,Smart Agent CPS ECU,The DTshows a projection of the behavior of the smart agent’scontrol algorithm in all situations,DIGITAL_PHYSICAL,digital twin,N/A,N/A,"linked predictive simulation, pure predictive simulation",The DT is an executabledescription of the algorithm that can be controlled ina simulated environment.,N/A,"As future work, we would like to extend the monitoringcomponents so as to address not only the input/output communicationsbut also intermediate states."
CristinaFrancodaSilva2021,HIGH,"In this article, weintroduce a novel concept called Cyber Digital Twin (CDT), which transfers the idea of the DT toautomotive software for the purpose of security analysis. In our approach, the ECU software (i.e.,firmware) is transformed into a CDT, which contains automatically extracted, security-relevantinformation from the firmware.",The Digital Twin is the idea to digitally represent physical objects to simulate them before they are built or to predict failures to enable predictive maintenance A CDT is a digital representation of an automotive software (ie firmware) and can provide many advantages with respect to automating security evaluation offirmwares,"boxes. The CDT approachpresented in this article can automatically extractimportant information from the firmware binariessuch as interfaces and data flow that is needed forother activities such as security analysis. This extractedinformation enables us to discover securityvulnerabilities in the firmware, and furthermore,to check if security requirements of the firmwareare fulfilled.",Mobility,"security analysis, security evaluation, verfication of security requirements",N/A,Firmware ,"binaries, IP email hashed passwords",DIGITAL_EXPERT,digital shadow,N/A,N/A,"replication/ Transformation, Retracing Vulnerabilities to Requirements",Transformin Firmware to Digital Twin,YES,"In future work, we plan to extend our approachto automatically generate test cases forthe CDT based on common cybersecurity requirementsof ECU software. From the software bill ofmaterials, we get a list of libraries used and thedeployed versions. We can use this informationto generate fuzz test cases in several ways. Thefirst and most straightforward way would be touse specific protocol fuzzers for libraries thatuse known protocols. Second, for the open-sourcelibraries, we can retrieve the interfaces and potentially mine input grammars from the repositoriesdirectly. Third, for commercial libraries, the furthercontrol and data flow analyses on the binariescan be used for fuzzing. Fourth, we could build adatabase of popular libraries, their interfaces andinteresting attach surfaces to fuzz correspondingtests."
Damjanovicbehrendt2018ab,HIGH,"Here, the Digital Twin demopnstroat is presented as a method for the design and implementaion of privacy enhancement mechanisms, and is used to detect privacy concerns and mimmize breaches and associated risks to which smart car drivers cvan vbe exposed ",The term digital twin was originally defined as a virtual representation of what has been manufactured through various lifecycle phases The Digital Twin is a virtual counterpart to actual physical devices (entities) that combines many Artifical Intelligence (AI) based technologies and methods real time predictive analysis and forecasting algorithms performing on top of Big Data redived from the IoT Sensors and acquired historical data,"it allos visibility in the manufacturing operations, it can be used to simulate various conditions, it can be used t o connect with the backend business apllications to support suply chain etc.",Mobility,privacy assessment,cloud,"Cars, Stakeholders","vehivle model,. Ob board sensor data, steering wheel feedback tuningg data, data require for tyre, driver skills, perceptio etc.",DIGITAL_EXPERT (Driver),digital twin,N/A,N/A,"security & privacy data analysis, safety and operational analysis, prediction & analytics based decisions for security, location based bevavioural analysis, tempral behavioural analsis of time series, behaviour and performance modelling ",N/A,N/A,Implementation of previous mentioned concept
Damjanovicbehrendt2018abc,HIGH,"We have designed a digital twin prototype for detecting security, privacy and safety criticalissues for the smart automotive sector, based on work done in the ongoing IoT4CPS project(Trustworthy IoT for cyber-physical Systems. that employs machine learning(ML) for behavioural analysis and forecastingof security, privacy and safetymeasures. The proposed prototype createsan open source environment thatcomprises the following three technologyblocks: (i) data collection andmanagement, (ii) computational modelmanagement and (iii) (micro-)servicemanagement.",N/A,"One of the desired features for the digitaltwin is the ability to accurately simulate,analyse and predict real-worldevents and situations.",Mobility,"threat detection, threat analysis, access control, incident response, security analytics",N/A,"Car, Smart Car","In order to do so,digital twins require a collection of datadescribing the physical world, context,events and situations to be mirrored inthe virtual space. The collected datainclude expert knowledge, historicaldata, inferred data, as well as data integratedfrom other enterprise systems andthird-party systems.",DIGITAL_PHYSICAL,digital twin,"dynamic model, behaviour model, ML, analytics, optimisation, static model, structural models, NoSQL, relational data models, rule engine ",N/A,"Simulation, Analysis, replication, Decision Making, Semantic Data Interoperability, Model Maangement","Digital twins require a collection ofmodels, e.g. data computational models(dynamic, behaviour models includingstatistical packages for ML, analytics,optimisation) and representationalmodels (static, structural modelsincluding semantic data models,NoSQL, relational data models, ruleengines)",YES,N/A
Damjanovicbehrendt2019a,HIGH,"We have designed a digital twin prototype for detecting security, privacy and safety criticalissues for the smart automotive sector, based on work done in the ongoing IoT4CPS project(Trustworthy IoT for cyber-physical Systems. that employs machine learning(ML) for behavioural analysis and forecastingof security, privacy and safetymeasures. The proposed prototype createsan open source environment thatcomprises the following three technologyblocks: (i) data collection andmanagement, (ii) computational modelmanagement and (iii) (micro-)servicemanagement.",N/A,"One of the desired features for the digitaltwin is the ability to accurately simulate,analyse and predict real-worldevents and situations.",Mobility,"threat detection, threat analysis, access control, incident response, security analytics",N/A,"Car, Smart Car","In order to do so,digital twins require a collection of datadescribing the physical world, context,events and situations to be mirrored inthe virtual space. The collected datainclude expert knowledge, historicaldata, inferred data, as well as data integratedfrom other enterprise systems andthird-party systems.",DIGITAL_PHYSICAL,digital twin,"dynamic model, behaviour model, ML, analytics, optimisation, static model, structural models, NoSQL, relational data models, rule engine ",N/A,"Simulation, Analysis, replication, Decision Making, Semantic Data Interoperability, Model Maangement","Digital twins require a collection ofmodels, e.g. data computational models(dynamic, behaviour models includingstatistical packages for ML, analytics,optimisation) and representationalmodels (static, structural modelsincluding semantic data models,NoSQL, relational data models, ruleengines)",YES,N/A
Danilczyk2019,HIGH,"In this paper, we present a framework foradapting the Digital Twin to the application of microgrid security.The Digital Twin is a real-time, physics-based simulation thatruns alongside the physical system providing for its constantmonitoring and control.",To accomplish this the digital twin needs to expand beyond the traditional modeling and simulation techniques by incorporating sensor feedback in the simulation and feeding information from the simulation back into the physical model in real time,The potential power of afully deployed digital twin provides exciting possibilities forimproving the cyber physical security of the future grid aswell as an avenue to visualize the response of the power gridwhen placed under duress,Smart Grid,monitoring,cloud,"Microfrid, Grid Communication Network",real-time dataabout the physical system and provide guidance in real-time.,DIGITAL_PHYSICAL,digital twin,SCADA,"Matlab App Designer, Mathworks Simulink, SimpowerSystems","Simulation, Machine Learning, Data Analysis, User Interface, Visualization",IEEE 39 Bus,NO,"Creating digital twins of individual devices or componentsto determine maintenance cycles and service life is valuable;however, the ability to leverage the digital twin to not onlymodel the full physical system but also to control, adapt an"
Dietz2020,HIGH,"To close this research gap, this work develops a process-basedsecurity framework to incorporate digital twin security simulationsin the SOC.",Generally a digital representation of any real world counterpart such as a system product process or other enterprise asset over its lifecycle can be referred to as digital twin  The digital twin comprises asset specific data and typically adds context to the data by semantic technologies Based on the semantically linked data analyses such as predictive maintenance can be conducted ,Allowing Simulations,Smart Manufacturing,"penetration testing, system security testing, attack simulation, analyzing effects",cloud,Industrial filing plant,PLC data with actuators,DIGITAL_EXPERT,digital twin,JSON,"Mininet, Ettercap, Filebeat, Logstash, Elasticsearch, Kibana, Dsiem",Simulation,Manually with MiniCPS,YES,"Differences DT concept in domains, misleading ersults when parameters are falsified, Security testing, How to connect DTs? Data Access??"
Dietz2020a,HIGH,N/A,In general a DT refers to a digital representation of any real world counterpart during its whole lifecycle At most times however it represents an industrial enterprise asset The core building blocks of the DT paradigm are asset specific data items often enhanced with semantic technologies as well as analysis simulation environments to digitally explore the real world asset,"DTs can play animportant role in mitigating and avoiding these risks byproviding comprehensive information about the asset’sstatus, history, and maintenance needs. Some DTs evenprovide direct interaction with the asset.",Smart Manufacturing,"intrusion detection, stimuli tracing, security by design, future prediction, reproducibility, repeatability, time independence, forensics, lifecycle centrality, security by design",N/A,ICS,PLC,DIGITAL_PHYSICAL,digital twin,"SCADA, AML",N/A,"Simulation, Replication, Analysis",There are works that aim for the automatedcreation of DTs by building a software-defined network(SDN) from the AML description of CPSs,YES,"Domain difference DT, expert knowledge, lack of data, security testing APT, dependencies between different twins, training"
Dietz2020abc,HIGH,N/A,The Digital Twin (DT) is an assets virtual counterpart that enables enterprises to digitally mirror and manage an asset along its lifecycle This asset can be tangible as well as non tangible   rangingfrom turbines to services Enterprise ASSET ASSET LIFECYCLE DATA SOURCES  DIGITAL TWIN SEMANTIC TECHNOLOGIES DATA ANALYSIS INTERFACES AND Asset CONTROL,"Here, a DT can play animportant role to mitigate or even avoid these risks bycomprehensively informing about the real-world asset’s status, history and its maintenance needs. Moreover, someDTs even provide a direct interaction with the asset.",Smart Manufacturing,security testing,"cloud, embedded",Every Asset,N/A,DIGITAL_PHYSICAL,digital twin,N/A,N/A,"Analysis, intelligence, simulation and other services",N/A,N/A,"One impact of DTs concernsthe improvement in interconnectivity, especially withinsupply chains, where research should not be limited to asingle firm’s perspective but rather take a system-of-systemsapproach. Another potential for enterprises is theclosure of feedback loops along and the coherent linkagebetween the lifecycle phases of the asset. Here, the gain ofnew insights can lead to a win-win situation among theinvolved parties. Currently, very little is known aboutpotential data-driven business models, their power of digitaldisruptiveness and pricing strategies for DT services.Research can contribute by identifying the strategic role ofDTs for firms and its position in digital transformation, notonly from the perspectives of companies owning the DTsbut also from third parties contributing to the resources.Nevertheless, first evidence indicates that DTs can give acutting edge for next-generation virtual asset management."
Eckhart2018,HIGH,"In this work, we present a framework that allows usersto create and execute digital twins, closely matching their physicalcounterparts.We focus on a novel approach to automatically generatethe virtual environment from specification, taking advantage ofengineering data exchange formats",The term Digital Twin was coined by Shafto et al [29] and describesthe use of holistic simulations to virtually mirror a physicalsystem [26],"On top of this virtual representation, multiple securityfeatures can be established. For example, security and safety rulesstated as part of the specification can be automatically monitoredon the basis of digital twins",Smart Manufacturing,"intrusion detection, system testing, system simulation, detecting misconfigurations, penetration testing",N/A,CPS,"HMIW, PLCs, Motor etc. ",DIGITAL_PHYSICAL,digital twin,N/A,"CPS Twinning, Mininet, MatIEC","Simulation, Analss",AML files (domain knowledge + engineer knowledge) manually,YES,"As future work, we want to focus on the replication mode ofthe framework, i.e., mirroring the state of physical systems to theircorresponding digital twins. To validate our approach, we plan tolaunch a MITM attack in the real environment for the purpose ofdetecting deviations in the behavior of digital twins to spot attacksas early as possible"
Eckhart2018a,HIGH,"In this paper, we propose anovel state replication approach that first identifies stimuli basedon the system’s specification and then replicates them in a virtualenvironment.",of digital twins1 ie virtual replicas of the network and the logiclayer of physical devices closely matching the physical devicesbehavior on these layers,"digital twins can run in parallel to a CPS, allowing toperform a security and safety analysis during operation withoutthe risk of disrupting live systems.",Smart Manufacturing,"security analysis, intrusion detection",N/A,ICS,"states of machines, network traffic, system logs, sensor measurements",DIGITAL_PHYSICAL,digital twin,N/A,"CPS Twinning, CPS State Replication, Mininet","Replicationm, FSM and behavioural models ",AML files (domain knowledge + engineer knowledge) manually,YES,"While the results of this work are promising, there are still somechallenges to be addressed to improve the state replication approach.For example, depending on the nature of the device or caused byinaccuracies of the specification, inferring the device’s characteristicsbased on the role definition may be infeasible. In this case,users are required to either add details about stimuli or explicitlylabel inputs as stimuli. Another possible option, yet more complexto implement, may be to develop a code analyzer that automaticallyinspects all programs, which are referenced in a CPS’s specification,for the purpose of stimuli identification. Furthermore, as ourapproach focuses only on states of software programs, support forreplicating stimuli that manifest themselves in the form of analogsignals is lacking. Thus, analog values that constitute stimuli mustbe converted to a binary representation, before they can be replicatedin the virtual environment. However, considering that CPSstypically consist of analog-intensive components, further researchin this area is worth pursuing."
Eckhart2018ab,HIGH,N/A,While theterm digital twin typically refers to adata driven or physical model of asystem we use it to describe an emulatedor simulated device that may beconnected to an emulated network Inthe context of this research digitaltwins reflect the correct behaviour oftheir physical counterparts as specifiedby experts from the industrial automationdomain,"As a result, a holistic security solutionthat not only protects the CPSduring operation, but rather throughoutits entire lifecycle is highly desirable.",Smart Manufacturing,"identification security weakness, security testing, monitoring, intrusion detection",N/A,CPS,"HMIW, PLCs, Motor etc. ",DIGITAL_PHYSICAL,digital twin,N/A,CPS Twinning,"Simulation, Analss",AML files (domain knowledge + engineer knowledge) manually,YES,"For future work, we intend to focus onthe simulation aspects of digital twinsby developing a feature that wouldallow users to recover historical statesof digital twins and replay their execution.In this way, certain scenarios canbe repeated for further analysis, e.g., tounderstand the propagation of malware"
Eckhart2019,HIGH,"In this chapter, we will discuss how digitaltwins can accompany their physical counterparts throughout the entire lifecycle andthereby strengthen the security of CPSs.",virtual replica of a system that accompanies its physical counterpartduring phases of its lifecycle consumes real time and historical data if required andhas sufficient fidelity to allow the implementation of the desired security measure,"Digital twins refer to virtual replicas of physical objects that, inter alia,enable to monitor, visualize, and predict states of cyber-physical systems (CPSs).",Smart Manufacturing,"security by design, intrusion detection, secure commissioning, detecting hardware misconfigurations, detecting software misconfigurations, security testing, privacy, system testing, system training, security compliance, legal compliance",cloud,"CPS environment, collobritations, functions, modules objectives, tasks",data availabe (everythng),"DIGITAL_PHYSICAL, DIGITAL_EXPERT",digital twin,"OPC UA , AML","CPS Twinning, Mininet","Repolication, Simulation, Analysis",AML files (domain knowledge + engineer knowledge) manually,NO,"In the future,more research isdefinitely required to investigate the practicality of the concept for security-enhancinguse cases."
Eckhart2019ab,MEDIUM,This survey article reviews the state of the art concerning quantitative security risk assessmentsfor ICSs and identifies promising opportunities for future research and associated challenges.,digital twin virtually replicates its physical counterpart such as anICS and can be employed for security improving use cases,Addressingthis issue requires innovative methods concerning the development of simulation platforms thatlend themselves well for assessing security risks,Smart Manufacturing,"quantitative security risk assessments, intrusion detection",N/A,"CPS environment, collobritations, functions, modules objectives, tasks",data availabe (everythng),DIGITAL_PHYSICAL,digital twin,N/A,N/A,"Simulation, Replication",engineering related data (specification files),NO,N/A
Eckhart2019abcde,HIGH,"This paper reports our work in progress to develop acyber situational awareness framework based on digital twins that provides a profound, holistic, and current view on thecyber situation that CPSs are in.",digital twin refers to a simulated or emulateddevice such as a programmable logic controller (PLC) that isconnected to an emulated network,"Although the digital-twin concept gives rise to amultitude of security-enhancing use cases [9], we put specialemphasis on the development of intrusion detection systems(IDSs)",Smart Manufacturing,cyber situational awareness,N/A,CPS,"sensor data, traffic, system logs, AML","DIGITAL_PHYSICAL, DIGITAL_EXPERT",digital twin,AML,"CPS Twinning, Mininet-WiFi","Simulation, Replication, Monitoring, Visualization",AML files (domain knowledge + engineer knowledge) manually,YES,"Furtherdevelopment effort is required to improve the visualizationof digital twins and to bring the record-and-replay featureto completion. Ideally, in the future, the introduced conceptcould be taken even one step further: instead of providing onlydecision support, the digital-twin framework could automatethe detection and mitigation of vulnerabilities, similar to acyber reasoning system."
