citation_key,relevance,main_contribution,DT_definition,DT_advantages,application_domain,application_scenario,DT_location,relevant_asset,data_type,communication_type,integration_level,used_protocols,used_tools,operation_mode,DT_generator,framework,challenges
OlivaresRojas2021,MEDIUM,This work shows a small implementation of a digital twin system for smart metering systems in a smart homeenvironment for testing cybersecurity issues,Digital Twins (DT) has emerged that allows the interaction between physicaland virtual objects considering a virtual object as areplica of the physical object allowing both to interactas if it were one,"With the modeling of systems through DT, significant benefits can be obtained in all areas andparticularly in the SG, and the SMS is no exception, allowing saving costs and improving decision-makingprocesses.",Smart Grid,"security testing, security evaluation",N/A,devices in a smart grid (smart home),sensor data/ historical sensor data,DIGITAL_PHYSICAL,digital twin,JSON,N/A,"replication, simulation, ",We develop a DT Framework mainly composed ofa DT Controller. ,YES,"As future works, it is intended to build a DTdisplay and controller system with a Graphical UserInterface (GUI) as well as expand the catalog ofphysical objects within SH."
Pokhrel2020,HIGH,"In this paper, we summarize the definition of digital twin and state-of-the-art on thedevelopment of digital twin including reported work on theusability of a digital twin for cybersecurity.",A digital twin is a replica model residing in a virtual environment that includeseverything that is known about an object,N/A,Smart Manufacturing,"Intrusion detection, anomaly detection, fault detection, monitoring, simulation","cloud, embedded","system, process ","sensor data, historical data, real-time data",DIGITAL_PHYSICAL,"digital twin, digital shadow",N/A,N/A,"simulation, analysis, replication, monitoring, predection",N/A,NO,Our future work will focus on the development ofdigital twin approaches for cybersecurity incident prediction. Wewill build our approach based on the existing methods and toolsidentified through the MLR.
Pushpa2020,LOW,"In this chapter, Methodologies for leveraging the Digital Twin using Fog/Edge computingwill be discussed with the suitable use case such as Wind Turbine, ProductManagement, Healthcare center and so on",Digital Twin can be defined as virtual device or monitoring device of physical entity whichcan be adopted by all factors in the world,The digital twin technology is to empower edge/fog devices to beintelligent in their actions and reactions.,Smart Manufacturing,"anomaly detection, failure forecasting, fault detection","edge, cloud",physical devices,Real-time data processing,DIGITAL_PHYSICAL,digital twin,N/A,N/A,"simulate, analysis",N/A,NO,"As the future beckons for edge/fogclouds for realizing and running real-time and insights-driven applicationsand services, the role and responsibility of having and using digital twinsfor all the participating physical twins are bound to go up in the days tocome. Further on, the analytical capabilities of both physical and digitaltwins come handy in making edge/fog devices (physical twins) adaptive,adjustive and autonomous."
Raj2021a,LOW,This chapter is to explain how they integrate and initiate newer opportunities to be grabbed andgained for a better tomorrow.,digital twins are the digital versions of physical objects,Digital twins collect value-adding data from theircorresponding physical twins continuously and crunch them in order toemit out useable insights out of data heaps.,Smart Manufacturing,"performance, health condition, security analysis",N/A,"different assests/objects (machines, an aerosol drug, Cambridge, a product, patient’s heart)","various real-world data, sensor data, historical data","DIGITAL_PHYSICAL, DIGITAL_TWIN",digital twin,N/A,N/A,"simulation, replication, ",N/A,NO,"Thus, with the cool synchronization withblockchain, the digital twin domain is to flourish in the years to come."
Ranjbar2020,LOW,The objective of the presented paper is to define the framework for a digital twin of the Canal of Calais.,A digital Twin aims to faithfully reproduce the dynamics of a canal,"A complete Digital Twin (DT) would cover whole the procedure from the beginning of a rawwater until it reaches the users such that, it observes the whole water cycle",Water Distribution Systems,anomaly detection,N/A,hydrographical network,data collected from SCADA,"DIGITAL_PHYSICAL, DIGITAL_TWIN",digital twin,N/A,"SCADA, Matlab",simulation,"ThedesignoftheDTrequiressomesteps:a)hydraulicmodelofthehydrographicalsystems,b)identificationofthedynamicsofthecontrolleddevicesandc)calibrationofthehydraulicmodel.",YES,"Futureworkswillconsistinimprovingthemodelsoftheoutletgates and thanks to the DT, it is now possible to test the advanced control and optimization algorithms such asmodel predictive controller."
Rasheed2020a,LOW,"In this work, we review the recent status of methodologies and techniques related to the construction of digital twinsmostly from a modeling perspective. Our aim is to provide a detailed coverage of the current challenges andenabling technologies along with recommendations and reections for various stakeholders.",Digital twin can be dened as a virtual representation of a physical asset enabled throughdata and simulators for real time prediction optimization monitoring controlling and improved decisionmaking,Digital twinning is now an important and emerging trend in many applications,Smart Manufacturing,"security analysis, fault detection, monitoring","cloud, edge","different assests/objects (offshore oil platform, human body, education sector, district heating and cooling network, etc.)","real-time (sensor) data, historical data",DIGITAL_PHYSICAL,digital twin,N/A,N/A,"simulation, analysis, monitoring, detection, ",N/A,NO,"While the denition of a digital twin is unambiguous,what is not a digital twin is a difcult question to answer.There is a need to quantify the degree to which a digital twinresembles its physical counterpart both in terms of appearanceand behaviour."
Rathore2021,MEDIUM,"Therefore, this article emphasizes the role of big data and AI-ML in the creation of digitaltwins (DTs) or DT-based systems for various industrial applications, by highlighting the current state-ofthe-art deployments.",Digital twinning is a process that involves the creation of avirtual model (ie a twin) of any physical object in orderto streamline optimize and maintain the underlying physicalprocess,digital twinning by collecting real-time data from the physical world andsharing it with the digital world,Smart Manufacturing,"threat detection, countermeasures, anomaly detection, best process strategy, best resource allocation, safety detection, fault detection)","cloud, edge",different assests/objects,"historical and real-time data, for different industries","DIGITAL_EXPERT, DIGITAL_PHYSICAL",digital twin,N/A,"Open Simulation Platform, FIWARE, Predix, IndraMotionMTX, Beacon, Thingworx, TwinCat, SAP,Codesys, CNC tools, Aspera,  RaySync, ANSYS Twin Builder, MWorks, Siemens NXsoftware, SolidWorks, Autodesk tools, FreeCAD","monitring, simulation, analysis","The data is fed to the data analysisand decision-making layer, where AI models, statisticaland probabilistic approaches, or mathematical models areemployed to create the DT-based system or the digital twin itself.",NO,"The rapidly increasing DT popularity and scope, as well as theinvolvement of IoT, big data, and AI technologies, broadenthe research challenges of digital twinning. These challengesare categorized in the following five areas: data collection, big data challenges, data analysis, dt standardization challenges, security and privacy issues"
Raybourn2018,HIGH,"The present chapter describes how improved modeling and simulation will increase situational awarenessby blurring the lines among the use of tools for analysis, rehearsal, andtraining—especially when coupled with immersive interaction experiences offeredby augmented reality",a virtual digital equivalent to a physical product,"Physical security system designers can take advantage of a twin collecting data and learning over time to check proposed design changes, anda vulnerability analyst can use that same data to identify possible threats and a site's readiness to handlethem",Generic,security evaluation,N/A,physical security systems,"historical and real-time data, sensor data",DIGITAL_PHYSICAL,digital twin,N/A,"Dante, MILES","analysis, simulation","Accurate facility modeling and terrain development are needed for security simulationsin general and to implement a digital twin. Data feeds must be added to reflectthe current situation on the ground along with adding predictive capabilities to thisadaptive model. The site’s digital twin needs sufficient data updates by variousmeans (e.g., sensor input, updates from responders) to stay synchronized withphysical counterparts, and support response force decisions with real-time status.Secure facilities usually have a variety of sensors including cameras, fence linesensors, and radars that can update the digital twin in real time, and this informationcan be made immediately available to the entire response force.",NO,"While the addition of digital twin technology could greatly enhance cyber-physicalsecurity systems, it may also present significant challenges for physical securitysystems and personnel.For example, a survey of different-sized companies found that many organizationsare not prepared for modern technical challenges. Digital twins present uniquemodern, socio-technical challenges; "
Reis2020,LOW,This work proposes a hybrid approach thatorchestrates unsupervised and incremental learning methods to detect threatsthat impact the control loops in a plant. We use online data processing to identifynew attack vectors.,N/A,N/A,Generic,honeypot,N/A,N/A,N/A,N/A,N/A,N/A,N/A,N/A,N/A,N/A,N/A
Riegler2021,LOW,"In this paper, we propose the design of resilient systems based on multi-modal architectures with several operational modes.",N/A,"Other than the use of different modes in digital twins [3] to detect, simulate and analyze attacks, as of our knowledge, there is no application of different modes inthe security context of IACSs.",Smart Manufacturing,"attack detection, attack simulation, attack analysis",N/A,N/A,N/A,N/A,N/A,N/A,N/A,N/A,N/A,N/A,"Our futurework includes systematic analysis and evaluation of mode switching protocols and an investigation of how to applythem to security, especially in the context of IACSs. First findings of a systematic literature review on mode switchingfrom a security perspective are presented in [20]. In addition, we plan a prototypical implementation for furtherevaluation and to demonstrate the effectiveness of mode switching for increased security."
Rubio2019,LOW,"this article will firstly study the spectrum of attack vectors that APTs can use against existing and novel elements of an industrial ecosystem. Afterwards, this article will provide an analysis of the evolu- tion and applicability of Intrusion Detection Systems (IDS) that have been proposed in both the industry and academia.",twins(virtual representations of subsystems,N/A,Smart Manufacturing,"anomaly detection, simulation",N/A,N/A,N/A,N/A,N/A,N/A,N/A,N/A,N/A,N/A,"There are still various areas that need of further research, such as the applica- bility and integration of proactive defense mechanisms, the inte- gration of defense mechanisms into IIoT and cloud computing de- ployments, and the advent of the Industry 4.0. Moreover, regarding APTs, it is imperative to (i) incorporate the knowledge of existing APTs and APT stages into the validation of defense mechanisms, and (ii) facilitate the integrability and usability of these defense mechanisms, so they can be easily included in more critical infras- tructures."
Saad2020,HIGH,This paper provides an IoT-based digital twin (DT) of the cyberphysicalsystem that interacts with the control system to ensureits proper operation.,The DT is defined as digital replica/model that includes thelast information matching a thing,"In this paper, an IoT-based digital twin (DT) for the cyberphysicalnetworked microgrids is introduced to enhance theresiliency against cyber attacks. The cloud-based DT platformis implemented to be a centric oversight for the NMG system",Smart Manufacturing,intrusion detection,cloud,cyberphysical networked microgrids,N/A,DIGITAL_PHYSICAL,digital twin,"MQTT, JSON",AWS,"replication, analysis, detection, monitoring","cloud-based DT platform is implemented to be a centric oversight for the NMG system.The cloud system hosts the controllers (cyber things) and thesensors (physical things) into the cloud IoT core in terms ofthe IoT shadow. The proposed DT covers the digital replicafor both the physical layer, cyber layers and their hybridinteractions.",YES,"Future research of this work willconsider the fusion of deep learning and LO to enhance thespeed, accuracy and predictability of the attacks."
Saad2020ab,LOW,This paper provides a methodology for the modelling of theimplementation of energy cyber-physical systems (ECPSs) that can be used for multiple applications.Two DT types are introduced to cover the high-bandwidth and the low-bandwidth applicationsthat need centric oversight decision making.,A digital twin can be defined as a digital replica/model that includes the last information matchinga thing,"there is a need for a conceptual framework that can monitor, collect, harness and interactwith the physical components to ensure their optimal operation. The digital twin (DT) concept arisesas a promising solution that can provide such a framework and unleash many opportunities and gainsthat are associated with the flow of data and real-time interaction.",Smart Manufacturing,"monitoring, attack detection",cloud,physical and cyber layers of the networked microgrids,"historical and real-time data, sensor data",DIGITAL_PHYSICAL,digital twin,"JSON, MQTT","Amazon Web Services, MATLAB Simulink","monitoring, analysis",N/A,YES,"The authors are currently developing a combination of deep learning and the DT to implement a wide-area situational awareness system by consideringthe stability, reliability and resiliency of the globally interconnected power system."
Sahal2021,LOW,This paper presents a conceptual framework for digital twins collaborationto provide an auto-detection of erratic operational data by utilizing operational data intelligencein the manufacturing systems.,Based on literature research we adopt the definition that the DT is an exact digital replica ofsomething in the physical world,"The DTs’ advantages in Industry 4.0 include improving data security and quality, reducingcost, and making faster decision-making",Smart Grid,"anomaly detection, data security",edge,production system (CPPS),"semantic models and operational data (i.e., failure and erroneous data).","DIGITAL_PHYSICAL, DIGITAL_TWIN",digital twin,"JSON, XML",N/A,"simulation, analysis, prediction",the development of DT needs threecomponents: (1) an information model that abstracts the specifications of a physical object;(2) a communication mechanism that transfers bi-directional data between a DT and itsphysical counterpart; and (3) a data processing module that can extract information fromheterogeneous multi-source data to construct the live representation of a physical object,YES,"semantic capabilities (e.g., knowledge graphs) could be explored to represent complex cyber-physical production systems; Some semantic work could be done to describe the relationshipsbetween the DTs models using model-to-model, e.g., OOP, RDF, and OWL in the complex DT systems heterogeneous DTs types; For flexibility and productivity, DTs should be used to balance and increase processing during work; Furthermore, blockchain technology could be combined with DTs collaboration toguarantee transparency, decentralized data storage, data sharing, peer-to-peer communication,secure and trusted traceability, and scalability."
Semenkov2020,LOW,The paper deals with the problem of the design of digital twins of cyberphysical systems of an Industry 4.0 concept.,A digital twin is an exact virtual copy of acyberphysical system,One of the promising functions of digital twins is the development of methods of cyberdefense and verification of thesystem’s resistance to cyber threats,Smart Manufacturing,"attack prevention, attack detection, countermeasures",cloud,CPS,real-time dataabout the physical system and provide guidance in real-time.,DIGITAL_PHYSICAL,digital shadow,NTP,ULCS,simulation,The design and deployment of digital twins of cyberphysicalsystems is an essential and expanding technology,NO,N/A
Semenkov2021 ,LOW,The work reviews and summarizes properties of models concerning the digitaland physical components of a cyberphysical system (CPS).,A digital twin is a virtual representation of a deviceor a group of devices that resides on a cloud or edge node It can be used to representreal world devices which may not be continuously online or to run simulations of newapplications and services before they get deployed to the real devices,One of the promising functions of digital twins is developing cyber defense methodsand testing the system’s resistance to cyber threats,Smart Manufacturing,"attack prevention, attack detection, countermeasures",cloud,CPS,"real-world data, simulation or machinelearning models, combined with data analysis",DIGITAL_PHYSICAL,digital twin,NTP,N/A,"simulation, analysis",initially designed as a system of nested containers. Every container serves as a framework for lower-level components and puts some additional constraint from upper-level requirements onto the container elements,YES,"We plan to continue workingwith the digital twin at other stages of the ULCS lifecycle. The main focus will be on improvingthe synchronization mechanisms of the digital twin and the real system, increasingthe accuracy of the models, first of all, in dynamical and temporal characteristics, and thedevelopment of techniques that allow diagnostics and prognostics of the behavior of a realsystem on a digital twin."
Shah2021,LOW,The primary goal of this paper is to arrive at a suit-able framework to construct DTs using open-source soft-ware programs.,N/A,A DT framework effortlessly allows for data communication andintegration between a physical system and a digital sys-tem in either direction.,Smart Manufacturing,"failure prediction, failure prevention",N/A,portable table-top sized temperature-controlled system,real-time data,DIGITAL_PHYSICAL,digital twin,N/A,"Robotic Process Automation, PLC, Eclipse Ditto",Simulation,"In order to successfully establish a DT environment, realtime decision-making along with rapid analysis is an impor-tant requirement.",YES,"Some of the limitations are as follows:a) The OpenFOAM solver only takes in one input andcomputes one output before it is ready to take anotherinput. We require the solver to take in multiple valuesand compute output in real time. Therefore, the PDEsolver built into OpenFOAM is not ecient enough toreduce the overall computation cost.b) In the simulation model, we can only compute onelayer of heat transfer at a time. There is no controlloop built into the SimFlow software that would allowus to run the hot subsystem and cold subsystem si-multaneously. A separate setup is required to executethe same.c) The UI Path Studio only works on windows basedsystem while the Physical model was designed on aLinux based system. This increases the overall com-putation cost of the system as certain additional stepsare required to establish prompt communication be-tween the digital and physical systems."
Shalaginov2019,LOW,The motivation of this contribution is to demonstrate howSmart Applications change the conventional understandingof Computer Forensics,N/A,"The number of surrounding IoT devices and computing nodes is growingto bring a concept of digital twin of homes, companies andenvironments into life. By utilizing all available data, one willbe able to reconstruct exact sequence of events attributed to acrime involving any kind of Smart Applications.",Organization,forensics,N/A,N/A,N/A,N/A,N/A,N/A,N/A,N/A,N/A,N/A,N/A
Shoumen2017,LOW,N/A,In its simplest form the concept of DIGITAL TWIN posits that the flow of data process and decision (as outlined above in this hypothetical scenario) is captured in a software avatar 34 that mimics the operation,The blockchain-like digital ledgers in the backbone of the digital twins may be useful in identifying the exact point of anomaly and the associated objects (including humans in the loop).,Organization,anomaly detection,edge,CPS,N/A,DIGITAL_PHYSICAL,digital twin,N/A,Avatar,"analysis, monitoring",the process of creating (building) digital twins and the adoption of digital twins may be restricted to an industrial oligopoly. The vast majority of users cannot deploy an army of engineers to create custom digital twins for their exclusive experiments.,NO,N/A
Stirna,LOW,This paper argues that the digital services provisioning network as a whole as well as individual nodes should possess security and resilience capabilities to ensure safe and sustainable delivery of the services.,Virtual representation of real life objects for monitoring and control purposes,to ensure that the adjustments (decisions and actions) are propagated to the service delivery including advanced visualization of the service ecosystem.,Organization,"monitoring, access control, data security",N/A,network and its services,"live data, ARTSS model, Historical data for simulation modeling purposes",DIGITAL_PHYSICAL,digital twin,N/A,ARTSS modeling tool,"monitoring, Simulation",The method component defines design of a digital twin according to the capability model.,YES,N/A
Sugumar2019,LOW,"The work presented here was to explore how a network of Timed Automata, integrated with those ofnoise and cyber-attacks, could be used to test the effectiveness of an attack detection mechanism in a CPS.",N/A,To investigate an approach based on timed automata models of a critical infrastructure,Generic,anomaly detection,N/A,6- stage water treatment plant,N/A,N/A,N/A,N/A,N/A,N/A,N/A,N/A,"As part of future work, we plan to develop a methodologyto automate and scale this process to larger installations thanSWaT."
Suhail2021,HIGH,This article focuses onsecuring CPSs by integrating Artificial Intelligence (AI) andblockchain for intelligent and trusted DTs.,DTs are virtual replicas of physical systems that mirror every facet of aproduct or process and can provide actionable insights throughmonitoring optimization and prediction,"Furthermore, replication and simulation modes in DTs can prevent and detect securityflaws in the CPS without obstructing the ongoing operations of the live system. ThroughDTs, attack scenarios can be simulated to analyze systembehavior under attack.",Generic,"intrusion prevention, intrusion detection, risk assement, configuration management, training, security testing",N/A,industrial processes,"sensor data from factory floor,historical production data acquired from product lifecycle data, and domain knowledge to generate comprehensivedata in the form of models, simulations, replications, or behavioral analytics.",DIGITAL_PHYSICAL,digital twin,AML,N/A,"simulation, analysis, replication",blockchain-based DigitalTwins (DTs),YES,"longstanding challenges. Forinstance, Due to the black-box nature of AI models, decisionsmade by the resulting systems suffer from a loss oftransparency and comprehensibility, hence can lead to anegative impact on the trustworthiness of the system [13].Hesitation is even higher in safety-critical CPSs where explainabilitybecomes crucial as slight dysfunction of AIbasedsystems may lead to erroneous decisions resultingin endangering human life or economic disaster. After deployment in the real world, ML models are expectedto perform deftly on unseen testing data. However,CPS underpinned by AI are vulnerable to adversarialperturbations under which wrongdoers try to morph itsadversarial input data to augment the misclassificationrate in the ML model. Attackers may begin with AIreconnaissance (i.e., observe the model’s behavior andlearn the decision logic or knowledge bases to morph themalicious payloads) and, without being detected, can feedtheir adversarial data to launch data exfiltration attacks."
