citation_key,relevance,main_contribution,DT_definition,DT_advantages,application_domain,application_scenario,DT_location,relevant_asset,data_type,communication_type,integration_level,used_protocols,used_tools,operation_mode,DT_generator,framework,challenges
Akbarian2020,HIGH,"In this paper, we propose implementing digital twins that have been equipped with an intrusion detection algorithm. Our novel algorithm is able to detect attacks in a timely manner and aslo diagnose the type of attack by classficiation of different types of attacks. ",mirror the internal behaviour of physical systems,So using this virtual environment for security tests instead of the real system prevents any interference with the live systems,Smart Manufacturing,intrusion detection,cloud,ICS,network data,DIGITAL_PHYSICAL,digital twin,N/A,KumarKandasamy2021,"Kalman Filter, Particle Swarm Optimization, SVM",Simulation model of the real system that has been obtained easily by system identification algorithms,YES,N/A
Almeaibed2021,MEDIUM,"This article aims to identify a standard framework for vehicular digital twins that facilitate data collection, data processing, and analytics phases. To demonstrate the effectiveness of the proposed approach, a case study for vehicle follower model is analyzed when radar sensor measurements are manipulated in an attempt to cause a collision.",In the perspective of autonomous vehicles a digital twin refers to the efforts placed in the design and implementation of processes needed to enhance the safety security and privacy of driverless cars,"Monitoring, reduces complexity, data analytics, connection",Mobility,"security testing, generation of knowledge",cloud,Car,"Sensor data, weather data, GPS",DIGITAL_PHYSICAL,digital twin,N/A,N/A,Simulation,N/A,YES,more security and privacy of car data
Anthony2020,LOW,This paper aims to present the development of a digital twin of the commercial greenhouse production process as a part of the recently launched EUDP funded project Greenhouse Industry 4.0 in Denmark. This digital twin allows using big data and the Internet of Things to optimise the greenhouse production process and communicate with other digital twins representing essential areas in the greenhouse (climate and energy).,DTs have been proved usefully in optimising systems based on collected data and how a system responds to changes in setting This can help stakeholders realise unexploited potentials and improve operational security,"Deploying the DT concept support co-optimization of the production schedule, energy  consumption, and labour cost, by considering influential factors including production deadlines, quality grading, heating, artificial lighting, energy prices (gas electricity), and weather forecasts",Smart Manufacturing,N/A,cloud,"Production, Climate, Energy",Sensor data,"DIGITAL_DIGITAL, DIGITAL_PHYSICAl",digital twin,N/A,Anylogic,Simulation,generic multi-agent simulation model of the greenhouse production flow that includes all production steps from the delivery of initial seedlings until the shipment of the final plants,NO,N/A
Assenza2020,LOW,This paper collects the contributions to the industry dis-semination session within the 14th International Conference on Critical Information Infrastructures Security (CRITIS 2019),The simulations can also be fast forwarded to foresee the effects of updates repairs preventive maintenance and even future threats,"Simulation, not interrupting system",Generic,intrusion detection,N/A,N/A,N/A,N/A,N/A,N/A,N/A,N/A,N/A,NO,N/A
Atalay2020,HIGH,"In this paper, we provide an overview of smart grid cybersecurity standards, and review major threats to smart grid environments at the physical, network and application layers. In order to overcome the current lack of standards for security evaluation of smart grids, we propose a digital twins based approach for the complete lifecycle of a smart grid, which accurately models the functioning of the physical grid and avoids service disruptions caused by running security tests on the actual grid.",At a high level a digital twin can be defined as a virtual replica of an object from the physical world ,"Generic penetration testing tools are incompetent for this task, as they are generally designed for smaller and more homogeneous networks.",Smart Grid,"penetration testing, intrusion detection",cloud,"Smart Meter, Actuator","Physical information devices identi?ers,model, version, storage, input and output size, and locationare kept as physical models. On the other hand, the deviceshave logical pro?les in the system, such as their mapping inthe virtual machine, the RAM size, the bandwidth, image size,processing power, etc. A dynamic knowledge database is required in the system,which keeps the logs of monitoring data to model the behaviorof a cloudlet. This knowledge database is frequently updatedand represents the pro?le of the ecosystem the cloudlet residesin. The database can be organized to store the energy trendinformation for different times and tasks. Physical models or behavioural models,  Network traffic",DIGITAL_PHYSICAL,digital twin,"TCP/IP, MQTT",N/A,"Simulation, Optimization, Machine Learning, Pattern, Outlier, Data Clustering",N/A,YES,Our ongoing work includes the modeling andimplementation of the proposed security evaluation frameworkfor real-world smart grid infrastructures.
Ayodeji2020,MEDIUM,"This paper examines recent advances in intrusion detection algorithms, their limitations, challenges and the status of their application in critical infrastructures.",N/A,without interrupting the real process.,Smart Manufacturing,"security evaluation, security testing, intrustion detection",N/A,Process,N/A,N/A,digital twin,N/A,"Nmap, Nessus",Simulation model,Design driven or data-driven,NO,N/A
Bajaj2020,LOW,N/A,N/A,N/A,Smart Manufacturing,intrusion detection,N/A,"Network, Machine",N/A,N/A,N/A,N/A,N/A,N/A,N/A,NO,"Automated vulnerability assessment and detection tools. Many tools currentlyexist but are not tuned for manufacturing or the operational requirements of aproduction setting.• Analytics-based detection—networks or machines—and use of digital twins.• Tools to audit the extent of attacks.• Automated, robust part validation technology, including automated distributedledger technologies such as blockchain, for trusted parts and data validation."
Bayanifar2017,LOW,"This study targets these concerns by proposing a generic model for intelligent distributed dependability and security supervision and control mechanisms to enable components to autonomously meet their own security and dependability objectives through real-time distributed improvement cycles, using multi-agent systems approach to enable full exploitation of the model’s evolution capabilities.",N/A,N/A,Smart Manufacturing,intrusion detection,N/A,"CPS environment, collobritations, functions, modules objectives, tasks",N/A,DIGITAL_PHYSICAL,digital twin,N/A,N/A,"Decison making agents via two levels, Filter out redundancies and monitor only useful data",N/A,NO,N/A
Becue2018,HIGH,"The CyberFactory#1 project (ITEA nr 17032) aims at solving this dilemma between productivity and security through the design, development and demonstration of a System of Systems that embraces the  technical, economical, human and the societal dimensions of future factories. It relies on innovative simulation, optimization and resilience capabilities.",A digital twin can be defined as an evolving digital profile of the historical and current behavior of a  physical object or process The digital twin is based on massive cumulative real time real world data measurements across an array of dimensions,"Cyber-physical modelling and digital twins: to support design, testing training and validation of secure by design FoF technologies. ",Smart Manufacturing,"design testing, training, validation of FoF technologies",cloud,"Indusrial Robots, PLC","collected machine, product and environment data, CTI, Operator Feedback",DIGITAL_EXPERT,digital shadow,N/A,CyberFactory#1,Ad-hoc algorithms,"The digital twin is based on massive, cumulative, real-time, real-world data measurements across an array of dimensions.",YES,N/A
Becue2020,HIGH,"In this paper, we address those limitations and propose innovations for cognitive modeling and co-simulation which may unleash novel uses of Digital Twins in Factories of the Future. We introduce a holistic Digital Twin approach, in which the factory is not represented by a set of separated Digital Twins but by a comprehensive modeling and simulation capacity embracing the full manufacturing process including external network dependencies.",a DT is a formal digital representation of some asset process or system that captures attributes and behaviors of that entity suitable for communication storage interpretation or processing within a certain context,"In this paper, we intend to examine the potential for involvement of DTs beyond the limits of their state-of-the-art functionalities. In particular, we address two limitations of existing technology which relate with: (i) the lack of applicable techniques to model human behavior and their interaction with machines; and (ii) the closed-system nature of existing DTs which limits their ability to provide holistic process optimization paths. With consideration for the above-mentioned cybersecurity challenges, we also examine the potential for DTs contribution to cyber-resilience objectives and propose a path for convergence with simulation tools currently in use in security business, called Cyber-Ranges (CRs).",Smart Manufacturing,"design optimization, system configuration management, upgrade validation, software update testing, resilience assessment",cloud,Human,"Keyboard, Mouse, Camera, Microphone, Eye-tracking, Emotions, Congitive Behaviour, tacit knowledge","DIGITAL_EXPERT, DIGITAL_PHYSICAL",digital twin,N/A,"CPS Twinning, Wrld3d, Mago3d, i-Maintenance, Eclipse Ditto, imodel.js, Twin-Control, Elasticsearch, Kibana ","Model training, GANN, VR, Feature extraction & Profiling","GANN, VR",YES,N/A
Biffl2019,LOW,This chapter summarizes and reflects on the material presented in this book regarding challenges and solutions for Security and Quality of Complex Cyber-Physical Systems (C-CPS) Engineering.,N/A,"The chapter shows that the following security-related digital twin use cases, which can be applied in engineering activities, are already discussed in the literature: (1) supporting the design of more secure CPSs, (2) detecting hardware and software misconfigurations, (3) conducting security testing, and (4) monitoring security and legal compliance.",Smart Manufacturing,"security by design, detecting hardware and software misconfigurations, conducting security testing, monitoring security, legal compliance",N/A,N/A,N/A,N/A,digital twin,N/A,N/A,N/A,N/A,NO,N/A
Biffl2019a,LOW,"This chapter overviews the engineering process of C-CPSs, typically longrunning technical systems, such as industrial manufacturing systems and continuous processing systems.",N/A,The chapter aims to demonstrate that digital twins can holistically improve the security of CPSs by applying security measures in various phases of their lifecycle.,Smart Manufacturing,"design security tests, security testing, intrusion detection",N/A,N/A,N/A,N/A,N/A,N/A,N/A,"Simulation, Replication",N/A,NO,N/A
Bitton2018,HIGH,"In this paper we suggest a method for creating a digital twin that is network-specific, cost-efficient, highly reliable, and security test-oriented.",N/A,"In contrast to testbeds, which are generic, a digital twin is a replica of a specific ICS; i.e., a model that consists of all of the components from the original industrial environment",Smart Manufacturing,"security evaluation, penetration testing",N/A,"SCADA, ICS, network",network traffic,DIGITAL_EXPERT,digital twin,"Modbus, DNP3","GRASSMARLIN, OpenVAS, Zeus Scanner, Nmap",Simulation,Formalization on how to derivce cost-efficient twins for ICS,NO,"In future work we plan to evaluate the method on more realistic environmentsfrom a diverse range of industries and propose a heuristic algorithm for finding a near-optimal solution (digital twin setup) with sub-exponential time complexity.In addition, we plan to extend the solution to support different pricing strategiesfor the various implementations, such as software bundles with contributionmargin-based pricing. We also plan to (1) add new types of constraints, e.g.,constraints that take the physical space available within the digital twin thatwill be implemented (e.g., a small room or an open space) into account; (2)consider implementations of multiple elements as virtual or simulations on thesame machine; and (3) handle identical setups in an industrial environment(e.g., if two similar production lines are implemented, there is no need to testboth of them). Finally, a general knowledge base of possible tests and their testdependencies should be researched and established."
Bore2020,MEDIUM,"This chapter discusses the threat arising from within the organisation, whether from negligence, malice, or exploitation by an external party. The trusted insider is one of the greatest challenges facing organisations today.",A synthetic behavioural model of a person or other entity used to predict behaviour whether predicting drug interactions in medical research or purchasing patterns in online shopping,Providing behaviour profiles for individuals in the form of a digital twin which can be subjected to much more thorough analysis than the individual otherwise would does have significant potential for improving the prediction of insider threat,Organization,insider threat detection,N/A,Human,Behavoural profiles for individuals (Social Networks etc.),N/A,N/A,N/A,N/A,Prediction,N/A,NO,N/A
Calo2018,LOW,"In this paper, we discuss a set of scenarios for access control needed in current and future systems and use that to argue that an approach for resources to generate and manage their access control policies dynamically on their own is needed.",N/A,The devices can use such a model to determine whether or not they should allow access to any resource or service that is being requested of them.,Organization,device model control,embedded,IoT Device,States depending on sensor data (unsafe/safe),DIGITAL_PHYSICAL,digital twin,N/A,N/A,Simulation,device state model,NO,"Defining the right high-level guidance:Access control policieswere introduced as the general approach for simplifyingthe application of access control mechanisms to a divergentBlue Sky Session: Next Generation SecurityServices for Emerging Networks SACMAT’18, June 13-15, 2018, Indianapolis, IN, USA45set of use-cases. We need to define a similar concept forhigh level guidance which will be applicable to variousscenarios and contexts in a general way. The semantics tobe used for high-level guidance needs to be defined. Whilethat semantics can be defined for each of the different generationapproaches discussed in Section 3, an open challengeremains that of identifying the abstraction that will createthe concept of the high level guidance that will be applicableto a broad set of use-case scenarios regardless of theapproach used to generate policies.(2) Defining the right discovery process: Generating the rightaccess control policy requires each of the resources in theenvironment to be aware of the other devices in the environment.Given the lack of widely adopted standards fordiscovery of resources, and the many security exposuresthat may result from a flawed discovery process, new discoverytechniques that can provide sufficient security in manydynamic contexts are needed.(3) Determining the situational context: The definition of thesituational context, as well as its determination, remainsa hard and open research challenge. Access control needsto account for not only the other resources that any givenresource interacts with, but also for the resources that mayindirectly use the information provided by that resource.Understanding the situation on the ground in sufficient detailto provide workable security is a challenge that can be solvedon a case-by-case basis, but a general formulation remainsan open challenge.(4) Policy deconfliction without human guidance: When accesscontrol policies are generated by the resources, they mayconflict among themselves, or with other policies that areimposed on the system to meet other requirements, suchas performance, reliability or availability requirements. Inthe presence of a human, such conflicts can be resolved anddeconflicted using the human provided input. Similar algorithms,which can operate without a human in the loop, needto be developed.(5) Controlling emergent behavior: When resources create theirown policies, there is a danger of uncontrolled emergentbehavior [15]. Emergent behavior is behavior shown by acollection of systems which was not originally designed buthappens due to the dynamic interactions among different intelligentsystems. Such emergent behavior can be controlled,but the design needs to account for that. The control ofemergent behavior in complete generality remains an openchallenge, but there may be solutions that can be developedfor specific domain of access control.(6) Learning-related challenges: The approach used by resourcesto learn their access control policy has to use some type oflearning approach, which creates a generalization based onits past experiences, but such learning mechanism has itschallenges. The set of experiences for access control in eachuse-case has only a few small data points to draw from,which means that either existing learning techniques thatuse only a few data points need to be used, or new learningtechniques requiring small data for training needs to be actor may manipulate the data so as to force the device tolearn an invalid model which could lead to generation ofinsecure access control policies. Solutions to such adversariallearning in uncontrolled environments need to be developed.(7) Increase in attack surface. The increase in complexity dueto autonomous generation of policies by devices can leadto new types of security vulnerabilities and threats, e.g. theadversarial learning example given above. This could lead tochallenges with established assurance processes in enterpriseand government networks, and the right way to provideassurance for systems using dynamically generated accesscontrol policies need to be developed.(8) Power, computation and communication efficiency. While inthe past several years there have been tremendous advantagesin the computational capacity of small devices, devicesthat need to learn and manage their own policies may findthemselves unable to use approaches that require specializedhardware, or significant computational power, e.g. learningmechanisms based on deep neural networks. For any solutiondeveloped with dynamic access control policies, systemdesign should incorporate mechanisms that take into accountthe limitations on a resource, which usually manifestsitself as limited amount of battery power, computationalcapacity or the ability to communicate at high bandwidthrates."
Campolo2020,LOW,"In such a context, in this paper we elaborate on the role of technologies like multi-access edge computing (MEC), Internet of Things (IoT) messaging protocols, such as Constrained Application Protocol (CoAP) and Message Queue Telemetry Transport (MQTT), and virtualization (i.e., digital twins) in the design of a framework enabling the collection and processing of data about the mobility of commuters and public transport vehicles.",As a result the digital twin enables data to be seamlessly transmitted between the physical and virtual worlds hence ensuring real time monitoring of systems helpful for their maintenance and for future upgrades,Digital Twin as Replication and provide sensitive views to stakeholders dependent on their right of PT vehicles,Mobility,access control,edge,MaaS vehicles,"e.g., smartphones of commuters, On Board Systems (OBSs) of PT vehicles",DIGITAL_PHYSICAL,digital shadow,"MQTT, COAP, LwM2m (Leshan), TCP, GPS","User Equipmment App, Mosquitto, Wireshark, DT applications hosted in MEC facilities can further access additional (context) information and provide accurate positioning via data fusion from multiple available sources, also improved by the ME LS.",Replication ,Data from ME (replication),YES,"Hence, as a future work we plan the deployment of the DTapplication as a Docker container, as well as the evaluationof its memory and CPU footprint when varying the availableprocessing resources and the number of commuters for a givenME host to figure out potential scalability issues for the actualdeployment."
Castellani2021,HIGH,"In this paper, we present novel weakly-supervised approaches to anomaly detection for industrial settings. The approaches make use of a Digital Twin to generate a training dataset which simulates the normal operation of the machinery, along with a small set of labeled anomalous measurement from the real machinery.", Digital Twin it can be realistic simulation which captures the qualitatively correct behavior of the machinery or an almost perfect digital copy whose output can be directly compared to the real world machinery,or an almost perfect digital copy whose output can be directly compared to the real-world machinery. The former can be at least used to create a large dataset containing data samples of normal operation conditions which can be utilized in machine learning approaches.,Smart Manufacturing,intrusion detection,N/A,"Heating, Ventilation and Air Conditioning (HVAC), Combined Heat and Power (CHP)","Ambient Temperature (Ta), Produced Thermal Power (PTh), Produced Thermal Energy (ETh), Produced Electrical Power (PEl), Produced Electrical Energy (EEl), Water flux (Flux), Water flow temperature (TFlow), Water return temperature (TReturn), Flow/return temperature difference (TDiff)",DIGITAL_PHYSICAL,digital twin,N/A,"PyOD, Keras, Tensorflow, SimulatinX, Modelica","Partial Grid Search, KNN, Siamese Autoencoder, Simuation",Green City Library ,NO,"The proposed algorithms are designed to easily incorporatethe expert-feedback therein. However, their evaluation is intentionallyleft for future work."
Catarci2019,MEDIUM,"We envision an architecture where humans can instead specify a goal and take advantage of technologies such as digital twins to automatically compose the corresponding physical processes, sharing some analogies with the notion of Web service composition.",A crucial difference between traditional software artifacts used in composition techniques and DTs is that DTs may not share the same view of the world Clearly a DT itself consists of an information model to describe its physical twin Specifically a DT can consist of different models and data that take into account the different phases of product life cycle Modern information systems and industrial machines may natively come out indeed with their digital twin,"First, the virtual environment provides a simulation mode, in which the DTs run independently from the physical environment. Second, the replication mode records events such as network traffic from the physical environment and replicates them in the virtual setup.",Smart Manufacturing,"monitoring, security analysis, intrusion detection",cloud,"Factories, Machines everythin","A device shadow is a JSON file that contains the state information, meta-data, timestamp, unique client token, and version of a device connected to the device shadow service.",DIGITAL_PHYSICAL,digital twin,"MQTT, COAP, LwM2m (Leshan), TCP, GPS, AutomationML, Manufacturing Service Description Language, system models, functional, JSON, REST API, 3D geometric models, multiphysics models, manufacturing models, usage models","Eclipse Ditto, GE Predix, Bosch IoT Things, Microsoft Azure IoT, IBM Watson IoT, AWS IoT, Experimentable DTs in virtuel testbeds,",Simulation,N/A,N/A,"How this confidence must be computed,according to the quality of machine learning tasksinvolved in DTs and in the mediator for entity resolution, isa challenging ongoing research task."
Chhetri2018,MEDIUM,"In this paper, we will present the various trends and advances in the security of the supply chain and  product lifecycle of the manufacturing system while highlighting the roles played by the major enabling components of Industry 4.0.",Digital twin is a virtual digital representation of a physical entity or system,"Digital twin allows the analysis of data and monitoring of systems to forecast problems even before they occur [148], thus preventing downtime and providing better efficiency.",Smart Manufacturing,"vulnerability prediction, impact of changes",N/A,N/A,N/A,N/A,N/A,N/A,N/A,N/A,N/A,N/A,N/A
