Key,G_Relevance,G_Contribution,RQ1_Definition,RQ2_Benefit,RQ2_Application_Domain,RQ2_Application_Scenario,RQ3_Deployment,RQ3_Asset,RQ3_Data,RQ3_Communication_Flow,RQ3_Level_of_Integration,RQ3_Protocol,RQ3_Tools,RQ3_Operation_Mode,RQ3_Generation,RQ3_Architecture,RQ4_Future_Research,RQ4_Challenges
Eckhart2019abcde,HIGH,This paper reports our work in progress to develop acyber situational awareness framework based on digital twins that provides a profound holistic and current view on thecyber situation that CPSs are in.,digital twin refers to a simulated or emulateddevice such as a programmable logic controller (PLC) that isconnected to an emulated network,Although the digital-twin concept gives rise to amultitude of security-enhancing use cases [9] we put specialemphasis on the development of intrusion detection systems(IDSs),Smart Manufacturing,cyber situational awareness,N/A,CPS,sensor data traffic system logs AML,DIGITAL_PHYSICAL DIGITAL_EXPERT,digital twin,AML,CPS Twinning Mininet-WiFi,Simulation Replication Monitoring Visualization,AML files (domain knowledge + engineer knowledge) manually,YES,Further development effort is required to improve the visualization of digital twins and to bring the record-and-replay feature to completion. Ideally in the future the introduced concept could be taken even one step further: instead of providing only decision support the digital-twin framework could automate the detection and mitigation of vulnerabilities similar to a cyber reasoning system., 
Empl2021,LOW,this paper conceptualizesa security analytics service used as a security add-onto these reference architectures. Thus this paper conceptualizes aflexible security analytics service that implements security capabilitieswith flexible analytical techniques that fit specific SMEs needs.,Concerning the security analytics servicessecurity modules a digital twin represents the link from real timedata to feasible simulation or forecast scenarios In this context thedigital twin is therefore regarded as a foresight security module,The sensor cloud collects and aggregates this data to determine the potential security state with security analytics (e.g. via a digital twin).,Smart Manufacturing,security analytics,N/A,N/A,N/A,N/A,N/A,N/A,N/A,simulations replications and analytics,N/A,NO,In the future we will work on implementing a prototype of this security analytics service. The design of a specific implementation can be structured in several ways.We recommend a design based on virtual machines dockerized applications and specific connectors for a straightforward adoption and application of the capability modules. As we admit in the introduction data is vital to generate wisdom. By bundling the data sources and types of data (stream vs batch) required to fulfil a particular capability module (e.g. the descriptive module takes batch data) analytical techniques can be instantiated. Thus each capability module should be represented by one virtual machine. The virtual machines can be interconnected with dedicated bridges to accomplish the dependencies between the capability modules. Each of the virtual machines is running on Docker to establish containerized and modular applications. There are many open-source software and tools for security analytics applications that need to be categorized depending on their functionality e.g. Suricata is an intrusion detection tool and is therefore available in the detective module. In this context the security analytics repository is considered a collection of dockerized applications. Besides provisioning dockerized applications the security analytics repositories need to yield connectors for each application to bind multiple applications‚Äô sinks and sources. Additionally machine learning models can be shared across the security analytics repository and integrated into the desired capability module. Those machine learning models might be integrated into the predictive module (stream data) and the descriptive module (batch data). The different analytical techniques can be tagged inside the security analytics repository (e.g. for detective module) and ranked by other users. These mechanisms are resulting in transparency as to which methods are successfully contributing to the cybersecurity,(Besides the contribution this paper exhibits two limitations. First we do not specify any access control roles to our security analytics service as we have only covered a single entity (security expert). Second we excluded parts of the incident response. As the response opportunities to a detected or predicted threat increase with the complexity of IIoT systems e.g. with software-defined networks for the ICS a holistic sketch of interconnections within the archi- tectural module is almost impossible.) 
Erol2020,LOW,In this study considering theimpressive potential of the Digital Twin technology in the fieldof health qualified studies that will guide future studies areemphasized.,The Digital Twin is a digital copy obtained by modelingthe state of a physical system collecting data through sensorsplaced on these systems and reflecting this data into digitalmedia Digital Twins build a bridge between the physical anddigital world by enabling us to understand the past and presentprocesses and make predictions for the future,Digital Twin technology will also help in early and accurate diagnosisof cancer diseases.,Smart Health,future predictions,N/A,patients radiology department Artificial Intelligence-based human biological systems or organs or molecular systems (physical) processes people human body soldiers,individual and population data real data,DIGITAL_EXPERT DIGITAL_PHYSICAL,digital shadow,N/A,N/A,simulation monitor,Digital twins used for this purpose are built on computer-based or in silico modelsthat are fed individual and population data,,In the future in addition to the health field mentioned in this study detailed studies can be carried out on Digital Twin technology from different perspectives such as aerospace military education security systems. Besides studies can be conducted for more specific application areas that have not been done yet in the field of health.,N/A
Fournaris2019,HIGH,In this chapter we explore thevarious CPS cybersecurity threats and discuss how adding security as a parameterat the CPS design phase can provide a well-structured and efficient approach onproviding strong securityCPS foundations.Newtechnologies onCPS security designare presented and emerging security directions are discussed.,Digital Twin (Tao et al 2018)by representing a digital model that accurately mimics its physical counterpart andevolves is continuously updated to reflect changes in the physical world (Maurer2017) becomes fertile ground for detecting deviations between the physical twin andits digital counterpart,This analysis feeds into the relatively modernconcept of a Digital Twin: an online cyber model of the physical processes takingplace in a CPS which can be used to simulate outcomes at decision points or monitorthe operation of a CPS in real time. In this sense a Digital Twin can incorporatemanyof the online threat detection and preventionmeasures discussed above.,Smart Manufacturing,monitoring controlling  security testing cyber-threat prevention threat detection intrusion detection,N/A,CPS,data from CPS,DIGITAL_PHYSICAL,digital twin,N/A,N/A,analysis simulation monitoring,N/A,NO,The first direction involves the formal description methods for the principal as well as for the emerging composable system properties and the exploitation of automatic executable model transformation and component code generation methods and tools in order to create security monitor(s) from a distributed system specification.Then there is the quest for the consolidation or even more the standardization of basic run-time frameworks component libraries and subsystem interfaces that will ease the deployment of interoperable customized components into generic domain-specific solutions and architectural frameworks,Then there is the quest for the consolidation or even more the standardization of basic run-time frameworks component libraries and subsystem interfaces that will ease the deployment of interoperable customized components into genericdomain-specific solutions and architectural frameworks. These include the prevalent reference architectures of Industry 4.0 and IIC and the challenge is enlarged after considering the widening of the Digital Twins deployment alternatives stemming from the expected evolution of AI capabilities in embedded devices at the edge in contrast to the typical cloud-based paradigm of today.
Furness2019,MEDIUM,N/A,A digital twin is a virtual representation of a physical object or system acrossits life?cycle It uses real?time data and other sources to enable learning reasoningand dynamically recalibrating for improved decision making (Mikell andClark 2018),Having access to a digitaltwin of a CPS would provide the ability to investigate responses of the system tothreats while not taking these systems offline.,Generic,threat response investigation monitoring application of security controls evaluation of vulnerabilities understanding of responses risk assessment,N/A,CPS,real?time data and other sources,DIGITAL_PHYSICAL DIGITAL_EXPERT,digital shadow,N/A,N/A,replication monitoring,N/A,NO,N/A,N/A
Gajek2020,MEDIUM,Hence to adequatelymanage these risks in the emerging digital world there is a vital necessity to raise awareness establish maintain and furtherdevelop cyber-security measures to ensure an appropriate level of protection along the entire value chain and supply chain.,A digital twin is a digital representation of a physical objectprocess or system and it can exist in many forms DigitalTwin in the human context is all the data footprint that weas humans create through our attributes and interactionsAttributes are core data that make up what we are includingname age gender address ethnicity education salary etcInteraction refers to all the data and footprint that is createdwhen we interact with the external world The term DigitalTwin therefore can be loosely applied to any form of digitalrepresentation,To manage and control aUSB device a means of binding the hardware with its digitaltwin is required. Once this is achieve a means of authenticationto confirm that the binding is correct and valid is alsorequired.,Smart Manufacturing,incident prevention,N/A,hardware (USB) physical objectprocess or system and it can exist in many forms,all the data footprint,DIGITAL_PHYSICAL DIGITAL_TWIN,digital twin,N/A,N/A,simulation replication,Creating a Digital Twin within a Blockchain is not differentfrom the standard approach. The manufacturer of thephysical object issues a cryptographic identifier. The correspondingcertificate attesting the objects attributes isstored in the blockchain.,NO,Further research is recommended to demonstrate the technical feasibility of implementation (for USB device management) in a factory environment.,N/A
GamezDiaz2020,MEDIUM,This article aims to provide a survey on the field of Digital Twintechnology focusing on machine learning and coaching techniques as they have not been exploredyet. We also define what Digital Twin Coaching is and categorize the work done so far in terms of theobjective of the physical activity.,Digital Twins are defined as digital replications of living as well as non living entities that enabledata to be seamlessly transmitted between the physical and virtual worlds ,The use of the Digital Twin technology can help bring a highly customizable solution to individuals.Digital Twin (DT) technology enables the collection and analysis of data about the real twin and providesthem with personalized feedback to improve their quality of life and wellbeing [89].,Smart Healthcare,data security,edge cloud,Player trainee (athletes),real-time and historical data,DIGITAL_PHYSICAL,digital twin,N/A,MATLAB C++ scikit-learn CAFFE Kinect Software Development Kit,machine learning analysis replication†,N/A,NO,N/A,N/A
Garcia2020,HIGH,We present potential approaches for implementing secure embedded intelligence (SEI) and integratedstate awareness (ISA) in advanced nuclear energy (NE) systems.,A DT is a computational model of a physical SSC Being a virtual replica of ita DT can act like the real SSC and assist in the interpretation of signaturesand patterns the testing of new settings the simulationand analysis of all types of scenarios and the execution of whatevermay be needed in a virtual environment knowing that whatit is observed in the DT would also arise in the physical asset (iSCOOP 2018),Typical applications benefiting from DDR  in waysthat improve reliability availability maintainability safety andsecurity (RAMS) and reduce costs and operational risks ñ includeanomaly detection diagnostics and prognostics root cause analysiscontrol optimization planning visualization commissioningand training. DT technology may also assist in remote operationmaintenance and repair of nuclear systems as well as providefeedback and insights for improving designs.,Nuclear Power Plants,threat detection intrusion detection,cloud edge,physical SSC CPS,sensor data models,DIGITAL_PHYSICAL,digital twin,N/A,N/A,replication analysis simulation ML,A distributeddigital twins (DDT) approach is proposed. To makethem work in cooperation knowledge databases should beequipped not only with episodic memory consisting of aseries of loosely connected parts or events but also withadvanced representation constructs and contents that canbe accessed and manipulated to support explanations generatedby embedded intelligent agents including larger-scalestructures for recording states plans actions and executiontraces.,YES,N/A,N/A
Gehrmann2020,HIGH,Inthis paper we discuss how a digital twin replication model andcorresponding security architecture can be used to allow datasharing and control of security-critical processes. We identifydesign-driving security requirements for digital twin based datasharing and control.,Originally the concept was used to refer to the digitalrepresentation of a product used in simulations software buthas been expanded to a concept where not only a physicalproduct is represented in virtual form (software) but eachproduct is directly connected with a virtual counterpart thedigital twin,We tackle this general security issue in thispaper by looking into the digital twin model as an enabler forenhanced security when opening up IACS low level controlfunctions and data exchange according to the Industry 4.0vision. Digital twins and state replication as security enablerswere recently proposed by different researchers,Smart Manufacturing,penetration testing security analysis monitoring,cloud,products production process (mentioned in the defintion part) IACS,N/A,DIGITAL_PHYSICAL,digital twin,AML,N/A,replication analysis. However the state replication design in [10] is built uponmeasurement of input values and that the physical and digitaltwin runs functional identical programs or what the authorsrefers to as passive state replication.,YES,Below we discuss the most important future work: Performance: We have here made first proof of concept of the architecture. In order to see the effect of the architecture on different platform and production scenarios more performance evaluations on different platform with more complex digital twin state models and with larger amount of production nodes are needed.  Intrusion detection: In our security architecture we have only show how on principle level how to integrate intrusion detection at the boarder to the virtual domain. It is left for future research to design and integrate intrusion detection in a fully working system.  Access control: The architecture allows for advanced access control in the virtual domain. The main advantage with this approach is that this can be supported without affecting the production domain at all. It remains to design and evaluate this approach in a full system implementation of the architecture. Formal security analysis: We have proven the consistency of the proposed synchronization protocol and showed that the security of the protocol depends on the security of the underlying used secure channel. Formal analysis of the security of the complete system design and all protocols are left for future work.  Security analysis services: Apart from IDS and access control enforcement in the virtual domain additional security analysis services may be supported as virtual components as we showed in our architecture design. This include services such as virus scan DoS prevention etc. The design and evaluation of such services is left to future research as well.,N/A
Glawe2020,LOW,The CyberFactory#1 project addresses these needs by providing a framework of possible capabilities for resilient FoF environments.,N/A,the digital-twin which simulates the architecture the anomaly detection to detect failures of the architecture and the reconfiguration/optimization to select new strategies.,Smart Manufacturing,training anomaly detection  strategy testing,N/A,manufacturing-execution-system (transportation system and the robots),real-time data and the historical data,DIGITAL_EXPERT DIGITAL_PHYSICAL,digital twin,N/A,N/A,simulation,TODO,YES,N/A,N/A
Grabis2021,MEDIUM,This paper proposes to ex-tend CDD to address security and resilience concerns in organizational networks. A method extension defining modeling concepts and development procedure is elaborated,N/A,patterns. The method also considers using a data-driven digital twin for continuous exploration and prediction of newly arising threats. The digital twin uses live data to evaluate the current situation and to appraise suitable response mechanisms. In order to explore network behavior depending on contextual changes and adjustments used its virtual representation or digital twin is used [12]. It uses live data to diagnose potential problems and to plan capability delivery.,Organization,incident diagnosis incident response threat prediction security analysis,N/A,CAN aspects of the capability delivery,lice data,DIGITAL_PHYSICAL,digital twin,N/A,DOE,simulation,The digital twin is based on a model rep-resenting the network. Various types of models including simulation statistical and machine learning could be used. The Design-of-experiments (DOE) module is used to specify scenarios to be explored to identify weaknesses and potential threats.,YES,The digital twin component is introduced in the paper. However the digital twin development process is still highly case specific. Formalization of the digital twin development and exploration processes in an area for future research. It should also be considered in relation to knowledge reuse in the form of patterns as suggested by the CDD methodology.  Integration between tools used in the CDD methodology and digital twin development technologies is also subject to further investigation.,N/A
Guo2020,MEDIUM,In the paper we analyze the cyber security risks fromelements of threats and vulnerability that are faced by ICS during the construction phase from the perspective of the businessowner of NPPs.,DT is atechnology to model assets with all their geometrical data kinematic functionality and logical behavior usingdigital tools not only to replicate but to digitize physical objects in virtual space and simulate the behaviorcharacteristics of physical objects in real environment,The three biggest advantages to use DT to construct aplatform for testing and verifying the defense architecture consist in: design phase of ICS operation Nuclear Power Plants,security testing security analysis,N/A,ICS,geometrical data kinematic functionality and logical behavior,DIGITAL_PHYSICAL,digital twin,N/A,N/A,Simualtion analysis,N/A,NO,proposes to explore an ICS test platform based on DT technology which allows us to monitor the running state of ICS and to verify any security measures before it is deployed in the real environment. However this paper also notes that although TC technology has been applied in the power industry there is no ICS based on TC technology in existing NPPs. It still requires enterprises in the supply chain to dedicate more researches. ,N/A
Hadar2020,HIGH,This paper presents a cyberdigital twin based on attack graph analytics that automaticallygathers and prioritizes security controls requirements at scale overactive networks.,Digital Twin stands for a softwarereplica that captures an aspect of a physical system  Theterm Digital Twin originated in the world of manufacturing,It isused to describe a digital replica of a system in a manner thatallows performing digital simulations. We apply this principle tothe realm of cyber security. CYBER DIGITAL TWIN,Organization,detecting missing security controls cybersecurity posture modeling,N/A,computer network SCRs,Analytical Attack Graph (AAG)?,DIGITAL_PHYSICAL,digital twin,N/A,AgiHack (Analytical Attack Graph (AAG)),Simualtion analysis,N/A,YES,In future work we intend to explore further security controls‚Äô interdependence and scaling of massive networks in heterogenous platforms. Additionally we intend to expand the landscape of vulnerabilities and types of attack tactics to domains such as the Internet of Things (IoT) application security in enterprise resource planning (ERP) systems different operational technology (OT) devices and embedded systems.,N/A
Hammoudeh2020,MEDIUM,This key note discussion outlines how to implement blockchainas a fundamental theory for trustless security for connected CNI,N/A,A digital twin provides a platform to solve majorIoT related CNI cybersecurity challenges in tomorrows secure infrastructureenergy distribution smart cities smart manufacturing(Industrial IoT and Industry4.0) and autonomous transit systems.,Generic,???,N/A,N/A,N/A,N/A,N/A,N/A,N/A,N/A,N/A,N/A,N/A,N/A
Hau2020,LOW,A design-centric modeling approach was proposed to model thebehaviour of the physical processes controlled by Industrial ControlSystems (ICS) and study the cascading impact of data-orientedattacks.,N/A,Thisallows us to build a model that is a digital twin of the physical CPSwe are modeling with respect to the pre-defined threat capabilitiesand goal.,Generic,intrusion detection simulation attack analysis,N/A,CPS,N/A,N/A,N/A,N/A,N/A,simulation,N/A,N/A,Further work also remains for the water treatment testbed model to study the improvement in resilience from implementing the recommended design changes. The current work looks into the cascading effects of attacks within a system however CPSs are usually not independent systems but are connected systems-of-systems (i.e. water treatment plant is connected to a water distribution network). Future research could focus on evaluating cascading effects of attacks on inter-connected systems.,Although the modeling approach may work well for a simple CPS such as SWaT there might be challenges with modeling more complex and large scale CPS due to the increased inter-dependencies of subsystems and non-linear dynamics. This could potentially be resolved by using composition of smaller models of subsystems and using linear approximation for the non-linearity in dynamics. It remains as part of future work for the evaluation of the applicability of modeling approach on other CPSs (i.e. Electric Power Grid Systems where generators switches/breakers and batteries are analogous to pumps valves and tanks).
He2019,MEDIUM,Given the importance of security in process systems this paper presents a data-driven digitaltwin system for automatic process applications by integrating virtual modeling process monitoringdiagnosis and optimized control into a cooperative architecture,Digital twinsdescribe the use of holistic simulations to virtually mirror a physicalsystem ,Adopting digital twins allows operators to monitorproductions test deviations in an isolated virtual environmentand further strengthen the security of process industries [6]. Adopting digital twins allows operators to monitorproductions test deviations in an isolated virtual environmentand further strengthen the security of process industries [6].,Smart Manufacturing,monitorin fault detection fault diagnosis,embedded,actual systems,N/A,DIGITAL_PHYSICAL,digital twin,N/A,N/A,monitoring analysis,The design process of digital twin systemis formulated as follows: First the adaptive closed-loop SIM isapplied to build the data-driven residual generator based on thevirtual system modeling with unknown parameters of plant models,,Concerning the future research more accurate fault diagnosis method would be focused as well as an efficient distributed digital twin approach should be developed to improve the practical application performance of systems.,N/A 
