Key,G_Relevance,G_Contribution,RQ1_Definition,RQ2_Benefit,RQ2_Application_Domain,RQ2_Application_Scenario,RQ3_Deployment,RQ3_Asset,RQ3_Data,RQ3_Communication_Flow,RQ3_Level_of_Integration,RQ3_Protocol,RQ3_Tools,RQ3_Operation_Mode,RQ3_Generation,RQ3_Architecture,RQ4_Future_Research,RQ4_Challenges
Akbarian2020,HIGH,In this paper we propose implementing digital twins that have been equipped with an intrusion detection algorithm. Our novel algorithm is able to detect attacks in a timely manner and aslo diagnose the type of attack by classficiation of different types of attacks. ,mirror the internal behaviour of physical systems,So using this virtual environment for security tests instead of the real system prevents any interference with the live systems,Smart Manufacturing,intrusion detection,cloud,ICS,network data,DIGITAL_PHYSICAL,digital twin,N/A,Simulink,Kalman Filter Particle Swarm Optimization SVM,Simulation model of the real system that has been obtained easily by system identification algorithms,YES,N/A,N/A
Almeaibed2021,MEDIUM,This article aims to identify a standard framework for vehicular digital twins that facilitate data collection data processing and analytics phases. To demonstrate the effectiveness of the proposed approach a case study for vehicle follower model is analyzed when radar sensor measurements are manipulated in an attempt to cause a collision.,In the perspective of autonomous vehicles a digital twin refers to the efforts placed in the design and implementation of processes needed to enhance the safety security and privacy of driverless cars,Monitoring reduces complexity data analytics connection,Mobility,security testing generation of knowledge,cloud,Car,Sensor data weather data GPS,DIGITAL_PHYSICAL,digital twin,N/A,N/A,Simulation,N/A,YES,more security and privacy of car data,N/A
Anthony2020,LOW,This paper aims to present the development of a digital twin of the commercial greenhouse production process as a part of the recently launched EUDP funded project Greenhouse Industry 4.0 in Denmark. This digital twin allows using big data and the Internet of Things to optimise the greenhouse production process and communicate with other digital twins representing essential areas in the greenhouse (climate and energy).,DTs have been proved usefully in optimising systems based on collected data and how a system responds to changes in setting This can help stakeholders realise unexploited potentials and improve operational security,Deploying the DT concept support co-optimization of the production schedule energy  consumption and labour cost by considering influential factors including production deadlines quality grading heating artificial lighting energy prices (gas electricity) and weather forecasts,Smart Manufacturing,N/A,cloud,Production Climate Energy,Sensor data,DIGITAL_DIGITAL DIGITAL_PHYSICAl,digital twin,N/A,Anylogic,Simulation,generic multi-agent simulation model of the greenhouse production flow that includes all production steps from the delivery of initial seedlings until the shipment of the final plants,NO,N/A,N/A
Assenza2020,LOW,This paper collects the contributions to the industry dis-semination session within the 14th International Conference on Critical Information Infrastructures Security (CRITIS 2019),The simulations can also be fast forwarded to foresee the effects of updates repairs preventive maintenance and even future threats,Simulation not interrupting system,Generic,intrusion detection,N/A,N/A,N/A,N/A,N/A,N/A,N/A,N/A,N/A,NO,N/A,N/A
Atalay2020,HIGH,In this paper we provide an overview of smart grid cybersecurity standards and review major threats to smart grid environments at the physical network and application layers. In order to overcome the current lack of standards for security evaluation of smart grids we propose a digital twins based approach for the complete lifecycle of a smart grid which accurately models the functioning of the physical grid and avoids service disruptions caused by running security tests on the actual grid.,At a high level a digital twin can be defined as a virtual replica of an object from the physical world ,Generic penetration testing tools are incompetent for this task as they are generally designed for smaller and more homogeneous networks.,Smart Grid,penetration testing intrusion detection,cloud,Smart Meter Actuator,Physical information devices identi?ersmodel version storage input and output size and locationare kept as physical models. On the other hand the deviceshave logical pro?les in the system such as their mapping inthe virtual machine the RAM size the bandwidth image sizeprocessing power etc. A dynamic knowledge database is required in the systemwhich keeps the logs of monitoring data to model the behaviorof a cloudlet. This knowledge database is frequently updatedand represents the pro?le of the ecosystem the cloudlet residesin. The database can be organized to store the energy trendinformation for different times and tasks. Physical models or behavioural models  Network traffic,DIGITAL_PHYSICAL,digital twin,TCP/IP MQTT,N/A,Simulation Optimization Machine Learning Pattern Outlier Data Clustering,N/A,YES,Our ongoing work includes the modeling andimplementation of the proposed security evaluation framework for real-world smart grid infrastructures.,there  is  a  lack of  standards  for  comprehensive  security  assessment  of  smart grids  which  is  a  critical  shortcoming 
Ayodeji2020,MEDIUM,This paper examines recent advances in intrusion detection algorithms their limitations challenges and the status of their application in critical infrastructures.,N/A,without interrupting the real process.,Smart Manufacturing,security evaluation security testing intrustion detection,N/A,Process,N/A,N/A,digital twin,N/A,Nmap Nessus,Simulation model,Design driven or data-driven,NO,N/A,N/A   
Bajaj2020,LOW,N/A,N/A,N/A,Smart Manufacturing,intrusion detection,N/A,Network Machine,N/A,N/A,N/A,N/A,N/A,N/A,N/A,NO,N/A,Automated vulnerability assessment and detection tools. Many tools currently exist but are not tuned for manufacturing or the operational requirements of a production setting. ‚Ä¢ Analytics-based detection‚Äînetworks or machines‚Äîand use of digital twins. ‚Ä¢ Tools to audit the extent of attacks. ‚Ä¢ Automated robust part validation technology including automated distributed ledger technologies such as blockchain for trusted parts and data validation. 
Bayanifar2017,LOW,This study targets these concerns by proposing a generic model for intelligent distributed dependability and security supervision and control mechanisms to enable components to autonomously meet their own security and dependability objectives through real-time distributed improvement cycles using multi-agent systems approach to enable full exploitation of the modelís evolution capabilities.,N/A,N/A,Smart Manufacturing,intrusion detection,N/A,CPS environment collobritations functions modules objectives tasks,N/A,DIGITAL_PHYSICAL,digital twin,N/A,N/A,Decison making agents via two levels Filter out redundancies and monitor only useful data,N/A,NO,N/A,N/A
Becue2018,HIGH,The CyberFactory#1 project (ITEA nr 17032) aims at solving this dilemma between productivity and security through the design development and demonstration of a System of Systems that embraces the  technical economical human and the societal dimensions of future factories. It relies on innovative simulation optimization and resilience capabilities.,A digital twin can be defined as an evolving digital profile of the historical and current behavior of a  physical object or process The digital twin is based on massive cumulative real time real world data measurements across an array of dimensions,Cyber-physical modelling and digital twins: to support design testing training and validation of secure by design FoF technologies. ,Smart Manufacturing,design testing training validation of FoF technologies,cloud,Indusrial Robots PLC,collected machine product and environment data CTI Operator Feedback,DIGITAL_EXPERT,digital shadow,N/A,CyberFactory#1,Ad-hoc algorithms,The digital twin is based on massive cumulative real-time real-world data measurements across an array of dimensions.,YES,N/A,N/A
Becue2020,HIGH,In this paper we address those limitations and propose innovations for cognitive modeling and co-simulation which may unleash novel uses of Digital Twins in Factories of the Future. We introduce a holistic Digital Twin approach in which the factory is not represented by a set of separated Digital Twins but by a comprehensive modeling and simulation capacity embracing the full manufacturing process including external network dependencies.,a DT is a formal digital representation of some asset process or system that captures attributes and behaviors of that entity suitable for communication storage interpretation or processing within a certain context,In this paper we intend to examine the potential for involvement of DTs beyond the limits of their state-of-the-art functionalities. In particular we address two limitations of existing technology which relate with: (i) the lack of applicable techniques to model human behavior and their interaction with machines,,,,,,,,,,,,,N/A,N/A
Biffl2019,LOW,This chapter summarizes and reflects on the material presented in this book regarding challenges and solutions for Security and Quality of Complex Cyber-Physical Systems (C-CPS) Engineering.,N/A,The chapter shows that the following security-related digital twin use cases which can be applied in engineering activities are already discussed in the literature: (1) supporting the design of more secure CPSs (2) detecting hardware and software misconfigurations (3) conducting security testing and (4) monitoring security and legal compliance.,Smart Manufacturing,security by design detecting hardware and software misconfigurations conducting security testing monitoring security legal compliance,N/A,N/A,N/A,N/A,digital twin,N/A,N/A,N/A,N/A,NO,N/A,N/A
Biffl2019a,LOW,This chapter overviews the engineering process of C-CPSs typically longrunning technical systems such as industrial manufacturing systems and continuous processing systems.,N/A,The chapter aims to demonstrate that digital twins can holistically improve the security of CPSs by applying security measures in various phases of their lifecycle.,Smart Manufacturing,design security tests security testing intrusion detection,N/A,N/A,N/A,N/A,N/A,N/A,N/A,Simulation Replication,N/A,NO,N/A,N/A
Bitton2018,HIGH,In this paper we suggest a method for creating a digital twin that is network-specific cost-efficient highly reliable and security test-oriented.,N/A,In contrast to testbeds which are generic a digital twin is a replica of a specific ICS,,,,,,,,,,,,,In future work we plan to evaluate the method on more realistic environments from a diverse range of industries and propose a heuristic algorithm for finding a near-optimal solution (digital twin setup) with sub-exponential time complexity. In addition we plan to extend the solution to support different pricing strategies for the various implementations such as software bundles with contribution margin-based pricing. We also plan to (1) add new types of constraints e.g. constraints that take the physical space available within the digital twin that will be implemented (e.g. a small room or an open space) into account,(2) consider implementations of multiple elements as virtual or simulations on the same machine,and (3) handle identical setups in an industrial environment (e.g. if two similar production lines are implemented there is no need to test both of them). Finally a general knowledge base of possible tests and their test dependencies should be researched and established.,N/A 
Bore2020,MEDIUM,This chapter discusses the threat arising from within the organisation whether from negligence malice or exploitation by an external party. The trusted insider is one of the greatest challenges facing organisations today.,A synthetic behavioural model of a person or other entity used to predict behaviour whether predicting drug interactions in medical research or purchasing patterns in online shopping,Providing behaviour profiles for individuals in the form of a digital twin which can be subjected to much more thorough analysis than the individual otherwise would does have significant potential for improving the prediction of insider threat,Organization,insider threat detection,N/A,Human,Behavoural profiles for individuals (Social Networks etc.),N/A,N/A,N/A,N/A,Prediction,N/A,NO,N/A,N/A
Calo2018,LOW,In this paper we discuss a set of scenarios for access control needed in current and future systems and use that to argue that an approach for resources to generate and manage their access control policies dynamically on their own is needed.,N/A,The devices can use such a model to determine whether or not they should allow access to any resource or service that is being requested of them.,Organization,device model control,embedded,IoT Device,States depending on sensor data (unsafe/safe),DIGITAL_PHYSICAL,digital twin,N/A,N/A,Simulation,device state model,NO,N/A,Defining the right ‚Äúhigh-level guidance‚Äù:Access control policies were introduced as the general approach for simplifying the application of access control mechanisms to a divergent Blue Sky Session: Next Generation Security Services for Emerging Networks SACMAT‚Äô18 June 13-15 2018 Indianapolis IN USA4 set of use-cases. We need to define a similar concept for ‚Äúhigh level guidance‚Äù which will be applicable to various scenarios and contexts in a general way. The semantics to be used for high-level guidance needs to be defined. While that semantics can be defined for each of the different generation approaches discussed in Section 3 an open challenge remains that of identifying the abstraction that will create the concept of the ‚Äúhigh level guidance‚Äù that will be applicable to a broad set of use-case scenarios regardless of the approach used to generate policies. (2) Defining the right discovery process: Generating the right access control policy requires each of the resources in the environment to be aware of the other devices in the environment. Given the lack of widely adopted standards for discovery of resources and the many security exposures that may result from a flawed discovery process new discovery techniques that can provide sufficient security in many dynamic contexts are needed. (3) Determining the situational context: The definition of the situational context as well as its determination remains a hard and open research challenge. Access control needs to account for not only the other resources that any given resource interacts with but also for the resources that may indirectly use the information provided by that resource. Understanding the situation on the ground in sufficient detail to provide workable security is a challenge that can be solved on a case-by-case basis but a general formulation remains an open challenge. (4) Policy deconfliction without human guidance: When access control policies are generated by the resources they may conflict among themselves or with other policies that are imposed on the system to meet other requirements such as performance reliability or availability requirements. In the presence of a human such conflicts can be resolved and deconflicted using the human provided input. Similar algorithms which can operate without a human in the loop need to be developed. (5) Controlling emergent behavior: When resources create their own policies there is a danger of uncontrolled emergent behavior [15]. Emergent behavior is behavior shown by a collection of systems which was not originally designed but happens due to the dynamic interactions among different intelligent systems. Such emergent behavior can be controlled but the design needs to account for that. The control of emergent behavior in complete generality remains an open challenge but there may be solutions that can be developed for specific domain of access control. (6) Learning-related challenges: The approach used by resources to learn their access control policy has to use some type of learning approach which creates a generalization based on its past experiences but such learning mechanism has its challenges. The set of experiences for access control in each use-case has only a few small data points to draw from which means that either existing learning techniques that use only a few data points need to be used or new learning techniques requiring small data for training needs to be actor may manipulate the data so as to force the device to learn an invalid model which could lead to generation of insecure access control policies. Solutions to such adversarial learning in uncontrolled environments need to be developed. (7) Increase in attack surface. The increase in complexity due to autonomous generation of policies by devices can lead to new types of security vulnerabilities and threats e.g. the adversarial learning example given above. This could lead to challenges with established assurance processes in enterprise and government networks and the right way to provide assurance for systems using dynamically generated access control policies need to be developed. (8) Power computation and communication efficiency. While in the past several years there have been tremendous advantages in the computational capacity of small devices devices that need to learn and manage their own policies may find themselves unable to use approaches that require specialized hardware or significant computational power e.g. learning mechanisms based on deep neural networks. For any solution developed with dynamic access control policies system design should incorporate mechanisms that take into account the limitations on a resource which usually manifests itself as limited amount of battery power computational capacity or the ability to communicate at high bandwidth rates.
Campolo2020,LOW,In such a context in this paper we elaborate on the role of technologies like multi-access edge computing (MEC) Internet of Things (IoT) messaging protocols such as Constrained Application Protocol (CoAP) and Message Queue Telemetry Transport (MQTT) and virtualization (i.e. digital twins) in the design of a framework enabling the collection and processing of data about the mobility of commuters and public transport vehicles.,As a result the digital twin enables data to be seamlessly transmitted between the physical and virtual worlds hence ensuring real time monitoring of systems helpful for their maintenance and for future upgrades,Digital Twin as Replication and provide sensitive views to stakeholders dependent on their right of PT vehicles,Mobility,access control,edge,MaaS vehicles,e.g. smartphones of commuters On Board Systems (OBSs) of PT vehicles,DIGITAL_PHYSICAL,digital shadow,MQTT COAP LwM2m (Leshan) TCP GPS,User Equipmment App Mosquitto Wireshark DT applications hosted in MEC facilities can further access additional (context) information and provide accurate positioning via data fusion from multiple available sources also improved by the ME LS.,Replication ,Data from ME (replication),YES,Hence as a future work we plan the deployment of the DT application as a Docker container as well as the evaluation of its memory and CPU footprint when varying the available processing resources and the number of commuters for a given ME host to figure out potential scalability issues for the actual deployment.,N/A
Castellani2021,HIGH,In this paper we present novel weakly-supervised approaches to anomaly detection for industrial settings. The approaches make use of a Digital Twin to generate a training dataset which simulates the normal operation of the machinery along with a small set of labeled anomalous measurement from the real machinery.,Digital Twin it can be realistic simulation which captures the qualitatively correct behavior of the machinery or an almost perfect digital copy whose output can be directly compared to the real world machinery,or an almost perfect digital copy whose output can be directly compared to the real-world machinery. The former can be at least used to create a large dataset containing data samples of normal operation conditions which can be utilized in machine learning approaches.,Smart Manufacturing,intrusion detection,N/A,Heating Ventilation and Air Conditioning (HVAC) Combined Heat and Power (CHP),Ambient Temperature (Ta) Produced Thermal Power (PTh) Produced Thermal Energy (ETh) Produced Electrical Power (PEl) Produced Electrical Energy (EEl) Water flux (Flux) Water flow temperature (TFlow) Water return temperature (TReturn) Flow/return temperature difference (TDiff),DIGITAL_PHYSICAL,digital twin,N/A,PyOD Keras Tensorflow SimulatinX Modelica,Partial Grid Search KNN Siamese Autoencoder Simuation,Green City Library ,NO,The proposed algorithms are designed to easily incorporate the expert-feedback therein. However their evaluation is intentionally left for future work.,N/A
Catarci2019,MEDIUM,We envision an architecture where humans can instead specify a goal and take advantage of technologies such as digital twins to automatically compose the corresponding physical processes sharing some analogies with the notion of Web service composition.,A crucial difference between traditional software artifacts used in composition techniques and DTs is that DTs may not share the same view of the world Clearly a DT itself consists of an information model to describe its physical twin Specifically a DT can consist of different models and data that take into account the different phases of product life cycle Modern information systems and industrial machines may natively come out indeed with their digital twin,First the virtual environment provides a simulation mode in which the DTs run independently from the physical environment. Second the replication mode records events such as network traffic from the physical environment and replicates them in the virtual setup.,Smart Manufacturing,monitoring security analysis intrusion detection,cloud,Factories Machines everythin,A device shadow is a JSON file that contains the state information meta-data timestamp unique client token and version of a device connected to the device shadow service.,DIGITAL_PHYSICAL,digital twin,MQTT COAP LwM2m (Leshan) TCP GPS AutomationML Manufacturing Service Description Language system models functional JSON REST API 3D geometric models multiphysics models manufacturing models usage models,Eclipse Ditto GE Predix Bosch IoT Things Microsoft Azure IoT IBM Watson IoT AWS IoT Experimentable DTs in virtuel testbeds,Simulation,N/A,N/A,How this confidence must be computed according to the quality of machine learning tasks involved in DTs and in the mediator for entity resolution is a challenging ongoing research task.,N/A
Chhetri2018,MEDIUM,In this paper we will present the various trends and advances in the security of the supply chain and  product lifecycle of the manufacturing system while highlighting the roles played by the major enabling components of Industry 4.0.,Digital twin is a virtual digital representation of a physical entity or system,Digital twin allows the analysis of data and monitoring of systems to forecast problems even before they occur [148] thus preventing downtime and providing better efficiency.,Smart Manufacturing,vulnerability prediction impact of changes,N/A,N/A,N/A,N/A,N/A,N/A,N/A,N/A,N/A,N/A,N/A,N/A
Choi2020,MEDIUM,In this paper we introduce a vendor-agnostic analytics framework which allows security researchers to analyse attacks againstICS systems even if the researchers have zero control automation domain knowledge or are faced with a myriad of heterogenous ICS systems.,N/A,digital twin systems mimicking real-world scenarios.,Smart Manufacturing,security testing securit evaluation,N/A,ICS ,The test digital twin system comprises of an HMI two PLCs two network switches and a firewall representativecomponents in most ICS scenarios.,DIGITAL_EXPERT,digital shadow,N/A,InTouch software from Schneider Electric CompactLogix 5370-L3 Schneider Electric Modicon M580 pfSense ettercap wireshark kdiff3 Kali Linux,Simulation,N/A,N/A,For future work we will continue to conduct further research on the countermeasures proposed earlier in this paper. Based on the data produced by our framework future research on preventative measures would be feasible and aligns well to the ultimate goal of our framework. As an extension of our approach we will conduct further experiments of our framework on an ICS with a fake PLC or add meaningless data fields to experiment control data integrity and resiliency.,N/A
Chukkapalli2021,MEDIUM,Therefore in this paper we present a smart fisheries ecosystemwhere the architecture describes various interactions that happenbetween internet connected devices. We develop a smart fisheriesontology based on the architecture and implement Attribute BasedAccess Control System (ABAC) where access to resources of smartfisheries is granted by evaluating the requests,The virtual replicas of the physical sensors deployed in the farm are represented as digital twins,They monitor the data generated from the physical sensors and notify the fish farm owners about a breakdown of a machinery in advance to reduce downtime by training machine learning models. Digital twins canalso be utilized for maintaining the data security and privacy whichis an added advantage. For example unauthorized transmissionof data can be avoided with the help of digital twin whenevera temporary worker tries to access previous data of the sensorspresent in the fish farm.,Smart Fishing,access control,cloud,Fish Farm,sensors present in the fishfarm via Internet.,DIGITAL_PHYSICAL,digital shadow,N/A,N/A,Replication ,N/A,YES,N/A,N/A
