Key,G_Relevance,G_Contribution,RQ1_Definition,RQ2_Benefit,RQ2_Application_Domain,RQ2_Application_Scenario,RQ3_Deployment,RQ3_Asset,RQ3_Data,RQ3_Communication_Flow,RQ3_Level_of_Integration,RQ3_Protocol,RQ3_Tools,RQ3_Operation_Mode,RQ3_Generation,RQ3_Architecture,RQ4_Future_Research,RQ4_Challenges
Murillo2020a,HIGH,In thisworkwe propose the Digital HydrAuLic SIMulator (DHALSIM)a Digital Twin for water distribution systems that simulatesphysical control and network processes. DHALSIM builds on theintegration of the Water Network Tool for Resilience (WNTR) hydraulicsimulator and MiniCPS an industrial network emulator which are run in a co-simulation environment.,Digital Twins are virtual replicas of CPS which are built to studyand optimize design deployment maintenance and upgrading operations,CPS have three main components: i) A physicalsystem or process ii) industrial control equipment monitoring andcontrolling such process iii) an industrial control network interconnectingthat equipment. Digital Twins can model these maincomponents with varying levels of fidelity depending on the specificpurpose and application.,Water Distribution Systems,attack simulation attack detection attack evalutation,N/A,CPS,physical and network data,DIGITAL_PHYSICAL,digital twin,AML SQLite,DHALSIM WNTR MiniCPS,simulation replication analysis monitoring,N/A,NO,In the first place WNTR provides limited water quality analysis capabilities meaning that we cannot (at this stage) thoroughly simulate the impact of cyber-physical attacks on water quality processes. In the near future we plan to take three research directions. First develop a module that imports EPANET / WNTR files to build automatically the Mininet topology and ICS equipment scripts. Second harness the data generated by DHALSIM to develop off-line and on-line intrusion detection and localization algorithms. Third adapt DHALSIM to be used as a Digital Twin that replicates the system state of existing physical testbeds such as WADI iTrust‚Äôs water distribution testbed [1]. This would include developing functionalities for acquiring data and controlling the testbed in real time.,DHALSIM has a few limitations that are inherited from WNTR MiniCPS and the co-simulation environment we created.
Neethirajan2021,LOW,Our goal in this review is to assess the progress toward the use of digital twintechnology in livestock farming with the goal of revolutionizing animal husbandry in the future.,digital twins are realistic virtual representations of a physical entity,The application of digital twins within thelivestock farming sector is the next frontier and has the potential to be used to improve large-scaleprecision livestock farming practices machinery and equipment usage and the health and well-beingof a wide variety of farm animals.,Smart Farming,N/A,N/A,pigsty animals (e.g. cows),real-time data sensor data,DIGITAL_EXPERT DIGITAL_PHYSICAL,digital twin,N/A,N/A,simulation replication analysis decision making,N/A,NO,There is a need for more evidence facts and case studies of this digital twin technology to encourage widespread adoption among livestock farmers.,(High Switching Cost Unknown Risks Lack of Concrete Evidence Low Return-on-Investment Sustainability)
OlivaresRojas2021,MEDIUM,This work shows a small implementation of a digital twin system for smart metering systems in a smart homeenvironment for testing cybersecurity issues,Digital Twins (DT) has emerged that allows the interaction between physicaland virtual objects considering a virtual object as areplica of the physical object allowing both to interactas if it were one,With the modeling of systems through DT significant benefits can be obtained in all areas andparticularly in the SG and the SMS is no exception allowing saving costs and improving decision-makingprocesses.,Smart Grid,security testing security evaluation,N/A,devices in a smart grid (smart home),sensor data/ historical sensor data,DIGITAL_PHYSICAL,digital twin,JSON,N/A,replication simulation†,We develop a DT Framework mainly composed ofa DT Controller.†,YES,As future works it is intended to build a DT display and controller system with a Graphical User Interface (GUI) as well as expand the catalog of physical objects within SH.,N/A
Pokhrel2020,HIGH,In this paper we summarize the definition of digital twin and state-of-the-art on thedevelopment of digital twin including reported work on theusability of a digital twin for cybersecurity.,A digital twin is a replica model residing in a virtual environment that includeseverything that is known about an object,N/A,Smart Manufacturing,Intrusion detection anomaly detection fault detection monitoring simulation,cloud embedded,system process†,sensor data historical data real-time data,DIGITAL_PHYSICAL,digital twin digital shadow,N/A,N/A,simulation analysis replication monitoring predection,N/A,NO,Our future work will focus on the development of digital twin approaches for cybersecurity incident prediction. We will build our approach based on the existing methods and tools identified through the MLR.,N/A
Pushpa2020,LOW,In this chapter Methodologies for leveraging the Digital Twin using Fog/Edge computingwill be discussed with the suitable use case such as Wind Turbine ProductManagement Healthcare center and so on,Digital Twin can be defined as virtual device or monitoring device of physical entity whichcan be adopted by all factors in the world,The digital twin technology is to empower edge/fog devices to beintelligent in their actions and reactions.,Smart Manufacturing,anomaly detection failure forecasting fault detection,edge cloud,physical devices,Real-time data processing,DIGITAL_PHYSICAL,digital twin,N/A,N/A,simulate analysis,N/A,NO,As the future beckons for edge/fog clouds for realizing and running real-time and insights-driven applications and services the role and responsibility of having and using digital twins for all the participating physical twins are bound to go up in the days to come. Further on the analytical capabilities of both physical and digital twins come handy in making edge/fog devices (physical twins) adaptive adjustive and autonomous.,N/A
Raj2021a,LOW,This chapter is to explain how they integrate and initiate newer opportunities to be grabbed andgained for a better tomorrow.,digital twins are the digital versions of physical objects,Digital twins collect value-adding data from theircorresponding physical twins continuously and crunch them in order toemit out useable insights out of data heaps.,Smart Manufacturing,performance health condition security analysis,N/A,different assests/objects (machines an aerosol drug Cambridge a product patientís heart),various real-world data sensor data historical data,DIGITAL_PHYSICAL DIGITAL_TWIN,digital twin,N/A,N/A,simulation replication†,N/A,NO,Thus with the cool synchronization with blockchain the digital twin domain is to flourish in the years to come.,digital twins can be made inaccessible or corrupted data can be submitted to digital twins to make wrong decisions
Ranjbar2020,LOW,The objective of the presented paper is to define the framework for a digital twin of the Canal of Calais.,A digital Twin aims to faithfully reproduce the dynamics of a canal,A complete Digital Twin (DT) would cover whole the procedure from the beginning of a rawwater until it reaches the users such that it observes the whole water cycle,Water Distribution Systems,anomaly detection,N/A,hydrographical network,data collected from SCADA,DIGITAL_PHYSICAL DIGITAL_TWIN,digital twin,N/A,SCADA Matlab,simulation,ThedesignoftheDTrequiressomesteps:a)hydraulicmodelofthehydrographicalsystemsb)identificationofthedynamicsofthecontrolleddevicesandc)calibrationofthehydraulicmodel.,YES,Future works will consist in improving the models of the outlet gates and thanks to the DT it is now possible to test the advanced control and optimization algorithms such as model predictive controller.,N/A
Rasheed2020a,LOW,In this work we review the recent status of methodologies and techniques related to the construction of digital twinsmostly from a modeling perspective. Our aim is to provide a detailed coverage of the current challenges andenabling technologies along with recommendations and reactions for various stakeholders.,Digital twin can be defined as a virtual representation of a physical asset enabled throughdata and simulators for real time prediction optimization monitoring controlling and improved decisionmaking,Digital twinning is now an important and emerging trend in many applications,Smart Manufacturing,security analysis fault detection monitoring,cloud edge,different assests/objects (offshore oil platform human body education sector district heating and cooling network etc.),real-time (sensor) data historical data,DIGITAL_PHYSICAL,digital twin,N/A,N/A,simulation analysis monitoring detection†,N/A,NO,N/A,While the denition of a digital twin is unambiguous what is not a digital twin is a difcult question to answer. There is a need to quantify the degree to which a digital twin resembles its physical counterpart both in terms of appearance and behaviour. Finally we would like to highlight the importance of standardization.
Rathore2021,MEDIUM,Therefore this article emphasizes the role of big data and AI-ML in the creation of digitaltwins (DTs) or DT-based systems for various industrial applications by highlighting the current state-ofthe-art deployments.,Digital twinning is a process that involves the creation of avirtual model (ie a twin) of any physical object in orderto streamline optimize and maintain the underlying physicalprocess,digital twinning by collecting real-time data from the physical world andsharing it with the digital world,Smart Manufacturing,threat detection countermeasures anomaly detection best process strategy best resource allocation safety detection fault detection),cloud edge,different assests/objects,historical and real-time data for different industries,DIGITAL_EXPERT DIGITAL_PHYSICAL,digital twin,N/A,Open Simulation Platform FIWARE Predix IndraMotionMTX Beacon Thingworx TwinCat SAPCodesys CNC tools Aspera  RaySync ANSYS Twin Builder MWorks Siemens NXsoftware SolidWorks Autodesk tools FreeCAD,monitring simulation analysis,The data is fed to the data analysisand decision-making layer where AI models statisticaland probabilistic approaches or mathematical models areemployed to create the DT-based system or the digital twin itself.,NO,N/A,The rapidly increasing DT popularity and scope as well as the involvement of IoT big data and AI technologies broaden the research challenges of digital twinning. These challenges are categorized in the following five areas: data collection big data challenges data analysis dt standardization challenges security and privacy issues
Raybourn2018,HIGH,The present chapter describes how improved modeling and simulation will increase situational awarenessby blurring the lines among the use of tools for analysis rehearsal and training especially when coupled with immersive interaction experiences offeredby augmented reality,a virtual digital equivalent to a physical product,Physical security system designers can take advantage of a twin collecting data and learning over time to check proposed design changes anda vulnerability analyst can use that same data to identify possible threats and a site's readiness to handlethem,Generic,security evaluation,N/A,physical security systems,historical and real-time data sensor data,DIGITAL_PHYSICAL,digital twin,N/A,Dante MILES,analysis simulation,Accurate facility modeling and terrain development are needed for security simulationsin general and to implement a digital twin. Data feeds must be added to reflectthe current situation on the ground along with adding predictive capabilities to thisadaptive model. The siteís digital twin needs sufficient data updates by variousmeans (e.g. sensor input updates from responders) to stay synchronized withphysical counterparts and support response force decisions with real-time status.Secure facilities usually have a variety of sensors including cameras fence linesensors and radars that can update the digital twin in real time and this informationcan be made immediately available to the entire response force.,NO,N/A,While the addition of digital twin technology could greatly enhance cyber-physical security systems it may also present significant challenges for physical security systems and personnel. For example a survey of different-sized companies found that many organizations are not prepared for modern technical challenges. Digital twins present unique modern socio-technical challenges,¬†
Reis2020,LOW,This work proposes a hybrid approach thatorchestrates unsupervised and incremental learning methods to detect threatsthat impact the control loops in a plant. We use online data processing to identifynew attack vectors.,N/A,N/A,Generic,honeypot,N/A,N/A,N/A,N/A,N/A,N/A,N/A,N/A,N/A,N/A,¬†Further work includes improving the false-positive rate of our classifier. Also we intend to apply our detection system to other types of plants and industrial protocols. We also plan to address privacy-related questions about knowl- edge extracted from the CPS analytics and about leakage of the CPS topology information as an outcome for honeypot exploitation,N/A (Applying machine learning algorithms to perform intrusion detection on real CPS is a challenging task. First data used to train the classifiers must be curated appropriately verifying that it includes not only normal operating conditions but also some conditions such as downtime caused by maintenance and even emergency stops on the CPS. Furthermore during the data acquisition process it is crucial to have the expertise of the CPS operators to label the events in the dataset correctly. Second CPS systems tend to operate for several years and the aging of the devices must be taken into consideration by the classifiers to avoid false positives. Finally the latency of the classification system must be considered to ensure that the attack countermeasure is responsive enough.)
Riegler2021,LOW,In this paper we propose the design of resilient systems based on multi-modal architectures with several operational modes.,N/A,Other than the use of different modes in digital twins [3] to detect simulate and analyze attacks as of our knowledge there is no application of different modes inthe security context of IACSs.,Smart Manufacturing,attack detection attack simulation attack analysis,N/A,N/A,N/A,N/A,N/A,N/A,N/A,N/A,N/A,N/A,Our future work includes systematic analysis and evaluation of mode switching protocols and an investigation of how to apply them to security especially in the context of IACSs. First findings of a systematic literature review on mode switching from a security perspective are presented in [20]. In addition we plan a prototypical implementation for further evaluation and to demonstrate the effectiveness of mode switching for increased security.,N/A
Rubio2019,LOW,this article will firstly study the spectrum of attack vectors that APTs can use against existing and novel elements of an industrial ecosystem. Afterwards this article will provide an analysis of the evolu- tion and applicability of Intrusion Detection Systems (IDS) that have been proposed in both the industry and academia.,twins(virtual representations of subsystems,N/A,Smart Manufacturing,anomaly detection simulation,N/A,N/A,N/A,N/A,N/A,N/A,N/A,N/A,N/A,N/A,There are still various areas that need of further research such as the applicability and integration of proactive defense mechanisms the integration of defense mechanisms into IIoT and cloud computing deployments and the advent of the Industry 4.0. Moreover regarding APTs it is imperative to (i) incorporate the knowledge of existing APTs and APT stages into the validation of defense mechanisms and (ii) facilitate the integrability and usability of these defense mechanisms so they can be easily included in more critical infrastructures.,N/A
Saad2020,HIGH,This paper provides an IoT-based digital twin (DT) of the cyberphysicalsystem that interacts with the control system to ensureits proper operation.,The DT is defined as digital replica/model that includes thelast information matching a thing,In this paper an IoT-based digital twin (DT) for the cyberphysicalnetworked microgrids is introduced to enhance theresiliency against cyber attacks. The cloud-based DT platformis implemented to be a centric oversight for the NMG system,Smart Manufacturing,intrusion detection,cloud,cyberphysical networked microgrids,N/A,DIGITAL_PHYSICAL,digital twin,MQTT JSON,AWS,replication analysis detection monitoring,cloud-based DT platform is implemented to be a centric oversight for the NMG system.The cloud system hosts the controllers (cyber things) and thesensors (physical things) into the cloud IoT core in terms ofthe IoT shadow. The proposed DT covers the digital replicafor both the physical layer cyber layers and their hybridinteractions.,YES,Future research of this work will consider the fusion of deep learning and LO to enhance the speed accuracy and predictability of the attacks.,N/A
Saad2020ab,LOW,This paper provides a methodology for the modelling of theimplementation of energy cyber-physical systems (ECPSs) that can be used for multiple applications.Two DT types are introduced to cover the high-bandwidth and the low-bandwidth applicationsthat need centric oversight decision making.,A digital twin can be defined as a digital replica/model that includes the last information matchinga thing,there is a need for a conceptual framework that can monitor collect harness and interactwith the physical components to ensure their optimal operation. The digital twin (DT) concept arisesas a promising solution that can provide such a framework and unleash many opportunities and gainsthat are associated with the flow of data and real-time interaction.,Smart Manufacturing,monitoring attack detection,cloud,physical and cyber layers of the networked microgrids,historical and real-time data sensor data,DIGITAL_PHYSICAL,digital twin,JSON MQTT,Amazon Web Services MATLAB Simulink,monitoring analysis,N/A,YES,The authors are currently developing a combination of deep learning and the DT to implement a wide-area situational awareness system by considering the stability reliability and resiliency of the globally interconnected power system.,N/A
Sahal2021,LOW,This paper presents a conceptual framework for digital twins collaborationto provide an auto-detection of erratic operational data by utilizing operational data intelligencein the manufacturing systems.,Based on literature research we adopt the definition that the DT is an exact digital replica ofsomething in the physical world,The DTs advantages in Industry 4.0 include improving data security and quality reducingcost and making faster decision-making,Smart Grid,anomaly detection data security,edge,production system (CPPS),semantic models and operational data (i.e. failure and erroneous data).,DIGITAL_PHYSICAL DIGITAL_TWIN,digital twin,JSON XML,N/A,simulation analysis prediction,the development of DT needs threecomponents: (1) an information model that abstracts the specifications of a physical object,,semantic capabilities (e.g. knowledge graphs) could be explored to represent complex cyber-physical production systems,Some semantic work could be done to describe the relationships between the DTs models using model-to-model e.g. OOP RDF and OWL in the complex DT systems heterogeneous DTs types,For flexibility and productivity DTs should be used to balance and increase processing during work,Furthermore blockchain technology could be combined with DTs collaboration to guarantee transparency decentralized data storage data sharing peer-to-peer communication secure and trusted traceability and scalability.,N/A
Semenkov2020,LOW,The paper deals with the problem of the design of digital twins of cyberphysical systems of an Industry 4.0 concept.,A digital twin is an exact virtual copy of acyberphysical system,One of the promising functions of digital twins is the development of methods of cyberdefense and verification of the systems resistance to cyber threats,Smart Manufacturing,attack prevention attack detection countermeasures,cloud,CPS,real-time dataabout the physical system and provide guidance in real-time.,DIGITAL_PHYSICAL,digital shadow,NTP,ULCS,simulation,The design and deployment of digital twins of cyberphysicalsystems is an essential and expanding technology,NO,N/A,N/A
Semenkov2021,LOW,The work reviews and summarizes properties of models concerning the digitaland physical components of a cyberphysical system (CPS).,A digital twin is a virtual representation of a deviceor a group of devices that resides on a cloud or edge node It can be used to representreal world devices which may not be continuously online or to run simulations of newapplications and services before they get deployed to the real devices,One of the promising functions of digital twins is developing cyber defense methodsand testing the systemís resistance to cyber threats,Smart Manufacturing,attack prevention attack detection countermeasures,cloud,CPS,real-world data simulation or machinelearning models combined with data analysis,DIGITAL_PHYSICAL,digital twin,NTP,N/A,simulation analysis,initially designed as a system of nested containers. Every container serves as a framework for lower-level components and puts some additional constraint from upper-level requirements onto the container elements,YES,We plan to continue working with the digital twin at other stages of the ULCS lifecycle. The main focus will be on improving the synchronization mechanisms of the digital twin and the real system increasing the accuracy of the models first of all in dynamical and temporal characteristics and the development of techniques that allow diagnostics and prognostics of the behavior of a real system on a digital twin.,The design and accurate realization of a digital twin remains a challenging task. In the paper we consider instrumentation and control systems (I&C systems) as cyberphysical systems (CPS) of the Industry 4.0 concept and in particular deal with the problem of the design of digital twins of CPS in application to I&C systems.
Shah2021,LOW,The primary goal of this paper is to arrive at a suit-able framework to construct DTs using open-source soft-ware programs.,N/A,A DT framework effortlessly allows for data communication andintegration between a physical system and a digital sys-tem in either direction.,Smart Manufacturing,failure prediction failure prevention,N/A,portable table-top sized temperature-controlled system,real-time data,DIGITAL_PHYSICAL,digital twin,N/A,Robotic Process Automation PLC Eclipse Ditto,Simulation,In order to successfully establish a DT environment realtime decision-making along with rapid analysis is an impor-tant requirement.,YES,N/A,The OpenFOAM solver only takes in one input and computes one output before it is ready to take another input. We require the solver to take in multiple values and compute output in real time. Therefore the PDE solver built into OpenFOAM is not efficient enough to reduce the overall computation cost. b) In the simulation model we can only compute one layer of heat transfer at a time. There is no control loop built into the SimFlow software that would allow us to run the hot subsystem and cold subsystem simultaneously. A separate setup is required to execute the same. The UI Path Studio only works on windows based system while the Physical model was designed on a Linux based system. This increases the overall computation cost of the system as certain additional steps are required to establish prompt communication between the digital and physical systems.
Shalaginov2019,LOW,The motivation of this contribution is to demonstrate howSmart Applications change the conventional understandingof Computer Forensics,N/A,The number of surrounding IoT devices and computing nodes is growingto bring a concept of digital twin of homes companies andenvironments into life. By utilizing all available data one willbe able to reconstruct exact sequence of events attributed to acrime involving any kind of Smart Applications.,Organization,forensics,N/A,N/A,N/A,N/A,N/A,N/A,N/A,N/A,N/A,N/A,N/A,N/A
Shoumen2017,LOW,N/A,In its simplest form the concept of DIGITAL TWIN posits that the flow of data process and decision (as outlined above in this hypothetical scenario) is captured in a software avatar 34 that mimics the operation,The blockchain-like digital ledgers in the backbone of the digital twins may be useful in identifying the exact point of anomaly and the associated objects (including humans in the loop).,Organization,anomaly detection,edge,CPS,N/A,DIGITAL_PHYSICAL,digital twin,N/A,Avatar,analysis monitoring,the process of creating (building) digital twins and the adoption of digital twins may be restricted to an industrial oligopoly. The vast majority of users cannot deploy an army of engineers to create custom digital twins for their exclusive experiments.,NO,N/A,N/A
Stirna,LOW,This paper argues that the digital services provisioning network as a whole as well as individual nodes should possess security and resilience capabilities to ensure safe and sustainable delivery of the services.,Virtual representation of real life objects for monitoring and control purposes,to ensure that the adjustments (decisions and actions) are propagated to the service delivery including advanced visualization of the service ecosystem.,Organization,monitoring access control data security,N/A,network and its services,live data ARTSS model Historical data for simulation modeling purposes,DIGITAL_PHYSICAL,digital twin,N/A,ARTSS modeling tool,monitoring Simulation,The method component defines design of a digital twin according to the capability model.,YES,N/A,N/A
