Improvements (RS.IM): Organizational response activities are improved by incorporating lessons learned from current and previous detection/response activities. ,RS.IM-1: Response plans incorporate lessons learned ,,,,,,,,,,,,,,,,,,,,,,,,,,,,,,,,,,,,,,,,,,,,,,,,,,,,,,,,,,,,,,,,,,,,,,,,,,,,,,,,,,,,,,,,,,,,,,,,,,,,,,,,,,,,
,RS.IM-2: Response strategies are updated,,,,,,,,,,,,,,,,,,,,,,,,,,,,,x,,,,,,,,,,,,,,,,,,,,,,,,,,,,,,,,,,,,,,,,,,,,,,,,,x,,,,,,,,,,,x,,x,,,,,,,,,,,,,,,,,
Recovery Planning (RC.RP): Recovery processes and procedures are executed and maintained to ensure restoration of systems or assets affected by cybersecurity incidents.,RC.RP-1: Recovery plan is executed during or after a cybersecurity incident,,,,,,,,,,,,,,,,,,,,,,,,,,,,,x,,,,,,,,,,,,,,,,,,,,,,,x,,,,,,,x,,,,,,,,x,,,,,,,,,,,x,,,,,,,,,,,x,,x,,,,,,,,,,,,,,,,,
Improvements (RC.IM): Recovery planning and processes are improved by incorporating lessons learned into future activities.,RC.IM-1: Recovery plans incorporate lessons learned,,,,,,,,,,,,,,,,,,,,,,,,,,,,,,,,,,,,,,,,,,,,,,,,,,,,,,,,,,,x,,,,,,,,,,,,,,,,,,,x,,,,,,,,,,,x,,,,,,,,,,,,,,,,,,,
,RC.IM-2: Recovery strategies are updated,,,,,,,,,,,,,,,,,,,,,,,,,,,,,x,,,,,,,,,,,,,,,,,,,,,,,,,,,,,,x,,,,,,,,,,,,,,,,,,,x,,,,,,,,,,,x,,,,,,,,,,,,,,,,,,,
"Communications (RC.CO): Restoration activities are coordinated with internal and external parties (e.g. coordinating centers, Internet Service Providers, owners of attacking systems, victims, other CSIRTs, and vendors). ",RC.CO-1: Public relations are managed ,,,,,,,,,,,,,,,,,,,,,,,,,,,,,,,,,,,,,,,,,,,,,,,,,,,,,,,,,,,,,,,,,,,,,,,,,,,,,,,,,,,,,,,,,,,,,,,,,,,,,,,,,,,,
,RC.CO-2: Reputation is repaired after an incident ,,,,,,,,,,,,,,,,,,,,,,,,,,,,,,,,,,,,,,,,,,,,,,,,,,,,,,,,,,,,,,,,,,,,,,,,,,,,,,,,,,,,,,,,,,,,,,,,,,,,,,,,,,,,
,RC.CO-3: Recovery activities are communicated to internal and external stakeholders as well as executive and management teams,,,,,,,,,,,,,,,,,,,,,,,,,,,,,x,,,,,,,,,,,,,,,,,,,,,,,,,,,,,,,,,,,,,,x,,,,,,,,,,,x,,,,,,,,,,,,,,,,,,,,,,,,,,,,,,
